address,city,districd,lat,lon,name,province,street,town
陕西商洛丹凤县环东路,商洛市,丹凤县,33.701537322920714,110.33356028859974,丹凤县台铃,陕西省,,
陕西省商洛市商州区夜村镇口前村,哈尔滨市,道外区,45.796094119695994,126.65416082325429,市辖区台铃,黑龙江省,,
陕西省商洛市洛南县保安镇眉底村红星车行,商洛市,洛南县,34.097070538846296,110.15442748007456,洛南县台铃,陕西省,,
陕西省商洛市商南县西关交警大队隔壁台铃电动车,商洛市,商南县,33.5375334767074,110.88840847836768,商南县台铃,陕西省,,
陕西省商洛市山阳县城关街道育才路防疫站对面台铃专卖店,商洛市,山阳县,33.53796838276926,109.88854863218121,山阳县台铃,陕西省,,
陕西省商洛市洛南县河滨南路西段烟草公司对面台铃专卖店,商洛市,洛南县,34.097070538846296,110.15442748007456,洛南县台铃,陕西省,,
陕西省商洛市林业局30米台铃专卖店,哈尔滨市,道外区,45.796094119695994,126.65416082325429,市辖区台铃,黑龙江省,,
