address,city,districd,lat,lon,name,province,street,town
河北省沧州市青县马厂镇王胜武屯村,沧州市,青县,38.588464758639795,116.81057477836235,青县台铃,河北省,,
任丘市华北石油世纪商贸城,沧州市,任丘市,38.717348630774524,116.1056050954973,任丘市台铃,河北省,,
河北省沧州市献县乐寿大街,沧州市,献县,38.19598143800661,116.12956002887077,献县台铃,河北省,,
河北省沧州市海兴县天嘉商厦南门右边路北,沧州市,海兴县,38.14940251651842,117.50441804918084,海兴县台铃,河北省,,
河北沧州黄骅中捷新区创业路南,沧州市,黄骅市,38.37749390073505,117.33648109171817,黄骅市台铃,河北省,,
河北省沧州市吴桥县华山道建行北邻,沧州市,吴桥县,37.63390875555352,116.39739206243448,吴桥县台铃,河北省,,
河北省沧州市新华区解放东路27号,哈尔滨市,道外区,45.796094119695994,126.65416082325429,市辖区台铃,黑龙江省,,
