address,city,districd,lat,lon,name,province,street,town
广东省珠海市金湾区红旗镇小林和兴路北供电所旁第一间商铺,珠海市,金湾区,22.1114209183398,113.29860185222778,广东珠海小林台铃专卖店,广东省,,
珠海市金湾区三灶镇榕月路38号,珠海市,金湾区,22.152576780675133,113.36951705357019,广东金湾三灶台铃专卖店,广东省,,
广东省珠海市南水镇祥环新村巴士站旁，川龙车行,珠海市,金湾区,22.152576780675133,113.36951705357019,广东珠海金湾台铃专卖店,广东省,,
广东省珠海市斗门区白蕉开发区景裕豪苑117-118商铺台铃电动车行,珠海市,斗门区,22.232426485307936,113.32448623803148,广东斗门白蕉台铃专卖店,广东省,,
广东省珠海市斗门区白藤街道白藤一路66-70号（旧农业银行旁）,珠海市,金湾区,22.147428315004028,113.36147542713906,广东斗门白藤台铃专卖店,广东省,,
广东省珠海市斗门区井岸镇井湾路477号，卓越车行,珠海市,斗门区,22.215426828038442,113.30407010735686,广东斗门井岸台铃专卖店,广东省,,
广东省珠海市高栏港经济区平沙镇平沙三路1005号,清远市,阳山县,24.703804002364084,112.66889418146879,广东高栏港平沙台铃专卖店,广东省,,
