address,city,districd,lat,lon,name,province,street,town
茂名市电白区水东镇人民路195号（茂南台铃运营中心）,茂名市,茂南区,21.669064031332095,110.931542579969,广东茂名茂南台铃专卖店,广东省,,
广东省化州市桔城中路33号，（化州市日日新车业贸易有限公司）,茂名市,化州市,21.670231093869553,110.64643101120122,广东化州县城台铃专卖店,广东省,,
广东省茂名市信宜市（东镇）人民南路,茂名市,信宜市,22.36009314172976,110.95358169717407,广东信宜台铃专卖店,广东省,,
广东省茂名市油城四路81号，天骥车行,茂名市,茂南区,21.669064031332095,110.931542579969,广东茂名市区台铃专卖店,广东省,,
高州市高凉西路142号,茂名市,高州市,21.924048896771122,110.85947386452162,广东高州台铃专卖店,广东省,,
广东省化州市那务镇莫海车行,茂名市,化州市,21.670231093869553,110.64643101120122,广东化州那务台铃专卖店,广东省,,
广东省茂名市电白区水东镇人民路195号,茂名市,电白区,21.52035118819837,111.02047123220541,广东电白水东台铃专卖店,广东省,,
