address,city,districd,lat,lon,name,province,street,town
松江区新桥镇新北街206号,上海市,松江区,121.321059,31.062702,上海市松江区新桥镇以海电动自行车经营部,上海市,,
上海闵行区东川路2673号,上海市,闵行区,121.401069,31.008715,上海市闵行区舒雯电动车经营部,上海市,,
上海市奉城镇川南奉公路9991号,上海市,奉贤区,121.640687,30.911326,上海广莹摩托车销售有限公司,上海市,,
上海闵行区颛建路8号,上海市,闵行区,121.399363,31.070558,上海枝坤商贸有限公司,上海市,,
上海市青浦区华新镇凤溪,上海市,青浦区,121.253199,31.202829,上海市青浦区华新镇胜祥摩托车修理部,上海市,,
松江松汇中路1058号,上海市,松江区,121.223296,31.003943,上海鑫焱电动车有限公司,上海市,,
上海市奉贤区金汇镇金钱公路692号,上海市,奉贤区,121.499885,30.983616,上海市奉贤区宇鑫车行,上海市,,
上海市金山区张堰镇松金公路2758号10幢A1018,上海市,金山区,121.2919,30.81006,上海帝鲍工贸有限公司,上海市,,
上海市松江区松江区荣乐东路1899号,上海市,松江区,121.256327,31.017216,上海市松江区中山街道道庆电动车经营部,上海市,,
上海市黄浦区制造局路352号,上海市,黄浦区,121.48468,31.206391,上海迅鸿车业有限责任公司,上海市,,
宝山区松兰路1072号,上海市,宝山区,121.443704,31.382924,上海李奎贸易有限公司,上海市,,
浦东新区城东路837号,上海市,浦东新区,121.76298,31.052089,上海骄驰摩托车销售有限公司,上海市,,
南汇区鹤沙路171号,上海市,浦东新区,121.599693,31.081638,上海市浦东新区航头镇双建车行,上海市,,
上海市嘉定区封浜新华公路1586号新日专卖店,上海市,嘉定区,121.300557,31.269319,上海金坝国彬贸易有限公司,上海市,,
上海市宝山区长江南路405--409号,上海市,宝山区,121.483605,31.335586,上海乘骏实业有限公司,上海市,,
上海嘉定区南翔镇古琦园路518号,上海市,嘉定区,121.312365,31.2954,上海市嘉定区南翔镇晓张车行,上海市,,
上海市嘉定区沪宜公路4544号（霍城路路口）,上海市,嘉定区,121.225635,31.368642,上海首闯实业有限公司,上海市,,
上海市宝山区电台路316号,上海市,宝山区,121.393857,31.350804,上海翊斐贸易有限公司,上海市,,
上海嘉定区马陆镇宝安公路3531号,上海市,嘉定区,121.276704,31.328469,上海巍光贸易有限公司,上海市,,
上海市宝山区庙行镇和康路70号,上海市,宝山区,121.442101,31.325504,上海市宝山区老李车行,上海市,,
上海市嘉定区外冈镇嘉松北路424号,上海市,嘉定区,121.178331,31.361049,上海市嘉定区外冈镇永尚电动自行车经营部,上海市,,
上海市嘉定区清河路453弄7号,上海市,嘉定区,121.234296,31.37548,上海万酝腾贸易商行,上海市,,
嘉定区江桥镇曹安公路沃尔玛楼下,上海市,嘉定区,121.26939,31.273551,上海卓秋贸易有限公司,上海市,,
上海市浦东新区川沙镇川沙路5140号,上海市,浦东新区,121.698673,31.190141,上海茜瑛电动车有限公司,上海市,,
宝山区大场镇南大路4-8号,上海市,普陀区,121.357514,31.291029,上海市宝山区俊世摩托车经营部,上海市,,
上海市嘉定区黄渡镇嘉松北路6991号,上海市,嘉定区,121.212222,31.27131,上海军义贸易有限公司,上海市,,
上海市普陀区杨柳青路398号,上海市,普陀区,121.400954,31.238175,上海彰耀贸易中心,上海市,,
上海市杨浦区沙岗路536，538号,上海市,杨浦区,121.536937,31.298879,上海市杨浦区葛三车行,上海市,,
上海市普陀区桃浦镇银杏路82号,上海市,普陀区,121.345999,31.286801,上海鑫马电动车车行,上海市,,
上海市长宁区可乐路208号,上海市,长宁区,121.363917,31.206397,上海小单车行,上海市,,
上海市闵行区北翟路1551号85幢一层A/A1室,上海市,闵行区,121.34036,31.223758,上海李姚贸易有限责任公司,上海市,,
上海金山区枫泾镇泾商路99弄3062号,上海市,金山区,121.009249,30.903876,上海芮临贸易有限公司,上海市,,
上海市青浦区白鹤镇赵江路157号,上海市,青浦区,121.08163,31.25632,徐宏(直营),上海市,,
上海市闵行区颛桥镇中春路988号10幢1层A区,上海市,闵行区,121.399156,31.039146,上海市闵行区黄军电动车销售部,上海市,,
上海市金山区金山卫镇学府路771号,上海市,金山区,121.321671,30.730724,上海市金山区夏玉妹家用电器经营部,上海市,,
上海市闵行区北翟支路62号,上海市,闵行区,121.295784,31.20351,上海市闵行区季勇车行,上海市,,
上海市松江区九亭镇228号,上海市,松江区,121.329098,31.132082,上海纯多工贸有限公司,上海市,,
上海市松江区九亭镇九新公路111号508室,上海市,松江区,121.319726,31.113441,上海雨双电子商务有限公司,上海市,,
松江区永丰街道仓汇路499号,上海市,松江区,121.202783,31.011415,上海市松江区永丰街道苏越电动自行车经营部,上海市,,
虹梅南路1559号,上海市,闵行区,121.426888,31.11783,上海小谢车行,上海市,,
上海市奉贤区南奉公路9310号,上海市,奉贤区,121.466471,30.912793,上海云滔电动车经营部,上海市,,
上海市闸北区西藏北路530号,上海市,静安区,121.469839,31.24999,上海牧新贸易有限公司,上海市,,
上海市浦东新区周浦镇康沈公路2218号,上海市,浦东新区,121.576172,31.117183,上海敏菊车业有限公司,上海市,,
上海浦东新区大团镇三宣公路365号,上海市,浦东新区,121.756429,30.991739,上海炫琴贸易有限公司,上海市,,
上海嘉定区安亭镇方泰镇花园浜路73-75号,上海市,嘉定区,121.21589,31.316641,上海市嘉定区安亭镇阿桂电动车车行,上海市,,
上海杨浦区辽源西路146号,上海市,虹口区,121.510966,31.268692,上海乃疆车行,上海市,,
上海市杨浦区政立路796号,上海市,杨浦区,121.495778,31.307827,上海广童宝贸易有限公司,上海市,,
上海闸北区芷江西路565号,上海市,普陀区,121.455529,31.256672,上海轮驰工贸有限公司,上海市,,
上海市浦东新区老港镇良欣路456号,上海市,浦东新区,121.847885,31.045815,上海港月摩托车销售有限公司,上海市,,
上海市浦东新区高科西路2970弄2号,上海市,浦东新区,121.560606,31.189124,上海剑文贸易有限公司,上海市,,
上海浦东新区唐镇唐镇路369号,上海市,浦东新区,121.654891,31.209682,上海助格实业有限公司,上海市,,
上海浦东新区高桥镇大同路660号,上海市,浦东新区,121.576259,31.339815,上海市浦东新区高桥镇菊新车行,上海市,,
上海崇明县长兴乡凤凰公路254-1号,上海市,崇明区,121.693082,31.390936,上海悦铸贸易有限公司,上海市,,
上海市崇明县向化镇向化大街244号,上海市,崇明区,121.722463,31.521903,上海市崇明县祖培电动自行车维修部(直营),上海市,,
浦东新区金桥博兴路851号,上海市,浦东新区,121.590839,31.265221,上海继望摩托车销售有限公司,上海市,,
浦东新区凌桥江东路1428号,上海市,浦东新区,121.544403,31.364909,上海龙犇贸易有限公司,上海市,,
崇明县城桥镇东门路132号,上海市,崇明区,121.401735,31.621611,上海市崇明县黄荣电动自行车经营部,上海市,,
浦东新区浦三路672号（高科西路交口）,上海市,浦东新区,121.516816,31.187496,上海市浦东新区南码头街道小任电动自行车经营部,上海市,,
上海市浦东新区杨新路14号,上海市,浦东新区,121.496997,31.163887,上海逐风商贸有限公司,上海市,,
上海市浦东新区下盐路3705号,上海市,浦东新区,121.70765,31.06878,上海市浦东新区宣桥镇小梁车业商贸行,上海市,,
上海市崇明县合作公路1227号,上海市,崇明区,121.36325,31.73675,上海市崇明县李伟伟电瓶车修理服务部,上海市,,
上海市浦东新区六灶镇周祝公路2251号,上海市,浦东新区,121.695802,31.116058,上海市浦东新区川沙新镇先锋摩托车商行,上海市,,
浦东新区张江镇川北公路新日电动车专卖店,上海市,浦东新区,121.613092,31.206288,上海小波摩托车销售商行,上海市,,
上海市崇明县新村乡1024号（乡镇府对面）,上海市,崇明区,121.33222,31.829588,上海市崇明县水兵自行车修理部,上海市,,
浦东新区沪南公路6118号,上海市,浦东新区,121.60201,31.025306,上海市浦东新区航头镇苏忠自行车销售部,上海市,,
上海市浦东新区三灶下盐路3893号,上海市,浦东新区,121.712221,31.068922,上海绮帘经贸发展有限公司(直营),上海市,,
上海市崇明县中兴镇汲浜村807号1幢,上海市,崇明区,121.762665,31.532601,上海市崇明县连生电动自行车修理部(直营),上海市,,
张扬路1707号,上海市,浦东新区,121.545944,31.237047,上海琦鲁商贸有限公司,上海市,,
浦东新区曹路镇银峰路541号,上海市,浦东新区,121.68923,31.26621,上海市浦东新区曹路镇银峰杂货店,上海市,,
浦东新区德平路1124号,上海市,浦东新区,121.56934,31.240225,上海贸亮实业有限公司,上海市,,
上海市浦东新区林鸣路21号,上海市,浦东新区,121.519969,31.130275,上海爽骑摩托车销售有限公司,上海市,,
浦东新区张杨路1707号,上海市,浦东新区,121.545944,31.236956,福俊摩托(直营),上海市,,
上海浦东新区陈春路272号与新浦路交叉路口,上海市,浦东新区,121.536548,31.168853,上海随发贸易有限公司,上海市,,
上海市浦东新区金桥路2690弄38号,上海市,浦东新区,121.603267,31.231403,上海齐豪锁具有限公司(直营),上海市,,
上海崇明县城桥镇东门路442号,上海市,崇明区,121.405204,31.630081,上海锋联电气设备有限公司(直营),上海市,,
上海市崇明县北陈公路1438号,上海市,崇明区,121.832631,31.525725,上海福神电动车有限公司(直营),上海市,,
浦东新区东明路1201号,上海市,浦东新区,121.514653,31.161097,上海随发贸易有限公司(直营),上海市,,
崇明岛北陈公路1348号,上海市,崇明区,121.815966,31.503917,龙圆车行(直营),上海市,,
浦东区川沙路1245号,上海市,浦东新区,121.678382,31.261728,上海大个子摩托销售有限公司,上海市,,
浦东新区军民路9号,上海市,浦东新区,121.632784,31.178593,张江镇王贤所电动车商行(直营),上海市,,
上海闵行区吴中路615号,上海市,闵行区,121.399154,31.18241,上海银乘商贸有限公司(直营),上海市,,
上海浦东新区杨园镇赵高路1568号,上海市,浦东新区,121.638216,31.29967,上海乐叶建材有限公司,上海市,,
上海浦东新区六团镇川六公路1717号,上海市,浦东新区,121.72568,31.154226,上海市浦东新区惠南镇航顺摩托车商店,上海市,,
上海浦东新区古桐路47号,上海市,浦东新区,121.612986,31.203363,上海小波摩托车销售商行,上海市,,
宝山区罗店镇罗升路256号,上海市,宝山区,121.342351,31.411235,宝山区罗店镇利达自行车商店(直营),上海市,,
上海浦东新区合庆镇东川公路7568号,上海市,浦东新区,121.725432,31.21982,上海浦东新区合庆镇双心自行车商店(直营),上海市,,
上海嘉定区南翔镇德华路419号,上海市,嘉定区,121.31155,31.29384,上海嘉定区南翔镇飞翔车行(直营),上海市,,
上海浦东新区张扬路1707号,上海市,浦东新区,121.5798,31.256508,上海福俊摩托车销售有限公司(直营),上海市,,
上海浦东新区上南路5165号,上海市,浦东新区,121.519582,31.129752,上海永蓄摩托车销售有限公司(直营),上海市,,
上海浦东新区惠南镇城东路270-272号,上海市,浦东新区,121.763079,31.050114,上海惠供摩托车销售有限公司(直营),上海市,,
宝山区大场镇环镇北路349号,上海市,宝山区,121.409179,31.308232,上海新煌商贸有限公司(直营),上海市,,
上海嘉定区封浜镇星华公路1656号,上海市,嘉定区,121.304789,31.25614,上海凯耀贸易有限公司(直营),上海市,,
上海浦东新区泥城镇南芦公路460号,上海市,浦东新区,121.828348,30.900578,上海浦东新区泥城镇成发车行兄弟连锁(直营),上海市,,
上海浦东新区川沙镇川沙路5101号,上海市,浦东新区,121.698701,31.190876,上海浦东晓昕工贸有限公司(直营),上海市,,
宝山区大场泸太支路1528号,上海市,宝山区,121.489612,31.405457,上海市浩天自行车商店(直营),上海市,,
宝山区罗泾镇陈镇路226-228号,上海市,宝山区,121.341389,31.482038,上海市宝山区华鑫自行车商店(直营),上海市,,
上海嘉定区马陆镇沪宜公路2102号,上海市,嘉定区,121.284988,31.330393,上海嘉定区马陆镇广辉电瓶车车行(直营),上海市,,
上海嘉定区戬浜镇嘉戬公路588号对面,上海市,嘉定区,121.289606,31.378129,嘉定区马陆镇刚强摩托车修理部(直营),上海市,,
上海市浦东新区川南奉公路6409号,上海市,浦东新区,121.775773,31.014221,上海彩郁贸易有限公司(直营),上海市,,
上海浦东新区张江镇孙桥路428弄1-2号,上海市,浦东新区,121.630441,31.177544,上海锃兴工贸有限公司(直营),上海市,,
上海宝山区顾北东路482,上海市,宝山区,121.408606,31.357517,上海市宝山区永盛电瓶车商店(直营),上海市,,
上海浦东新区东海镇盐朝公路776号,上海市,浦东新区,121.808692,31.092834,上海春芳车行有限公司(直营),上海市,,
上海浦东新区六灶镇周祝公路2251号,上海市,浦东新区,121.695802,31.116058,上海南汇区先锋摩托车商行,上海市,,
上海浦东新区航头镇富航路9号,上海市,浦东新区,121.596972,31.027473,上海秀民摩托车销售有限公司,上海市,,
上海浦东新区上南路1640号,上海市,浦东新区,121.496617,31.167939,上海吉源摩托车销售有限公司(直营),上海市,,
上海浦东新区祝桥镇东大街12号,上海市,浦东新区,121.757006,31.116769,上海敏菊车业有限公司(直营),上海市,,
上海嘉定区清河路436号,上海市,嘉定区,121.235202,31.377032,上海宜馨贸易商行(直营),上海市,,
上海浦东新区苏召路1428号,上海市,闵行区,121.537222,31.099636,上海永蓄摩托车销售有限公司-苏召路店(直营),上海市,,
上海市杨浦区翔殷路481号近包头南路,上海市,杨浦区,121.537755,31.30644,上海市杨浦区晓富非机动车修理行(直营),上海市,,
上海交通大学东川路800号,上海市,闵行区,121.431007,31.016939,卢飞,上海市,,
奉贤区南庄路1号,上海市,奉贤区,121.462451,30.895877,上海梁郢贸易有限公司(直营),上海市,,
上海闵行区华漕镇北翟路1552号,上海市,闵行区,121.339019,31.224324,上海市闵行区倪思涛车行(直营),上海市,,
上海市松江区九亭镇中心路1号,上海市,松江区,121.322431,31.120438,松江区九亭镇誉全电动车商行,上海市,,
上海市金山区张堰镇松金公路2678号,上海市,金山区,121.291338,30.807292,上海市金山区堰军摩托经营部,上海市,,
青浦区徐泾镇,上海市,青浦区,121.272369,31.17309,上海缪杰商贸有限公司,上海市,,
闵行区北桥镇新苗路168号,上海市,闵行区,121.407719,31.039582,李香花,上海市,,
嘉定区江桥镇华江路900号,上海市,嘉定区,121.325568,31.23757,上海市松江区九亭镇候磊车行(直营),上海市,,
嘉定区霍城路与沪宜公路交汇处,上海市,嘉定区,121.226039,31.368465,上海市嘉定区嘉定工业区北区李杨电瓶车经营部(直营),上海市,,
杨浦区包头路1087号,上海市,杨浦区,121.537813,31.329951,上海市杨浦区小梅电动自行车行,上海市,,
徐汇区百色路12号,上海市,徐汇区,121.45017,31.14442,陈杰(直营),上海市,,
上海市嘉定区菊园新区平城路2319,上海市,嘉定区,121.220037,31.38078,上海市嘉定区菊园新区建成自行车经营部(直营),上海市,,
上海嘉定区江桥镇曹安公路沃尔玛楼下,上海市,嘉定区,121.26939,31.273551,罗林成(直营),上海市,,
上海市普陀区古浪路603号,上海市,普陀区,121.381679,31.283588,上海市普陀区阿明电动车行,上海市,,
浦东新区永泰路1404号,上海市,浦东新区,121.530705,31.143759,上海随发贸易有限公司（永泰路店）(直营),上海市,,
上海市浦东新区三灶镇下盐公路3959号,上海市,浦东新区,121.714851,31.069277,上海南汇区宣桥镇小乔摩托车配件经营部(直营),上海市,,
上海市徐汇区冠生园路223号21幢353室,上海市,徐汇区,121.4278,31.16326,上海昊喆实业有限公司,上海市,,
宝山区德都路200-9号,上海市,宝山区,121.425114,31.410255,上海尚品电动车专卖(直营),上海市,,
徐汇区龙吴路1127号,上海市,徐汇区,121.450444,31.145605,上海广渥电动车销售有限公司,上海市,,
嘉定区南翔镇德华路697号,上海市,嘉定区,121.306551,31.291826,上海铭崖贸易发展有限公司,上海市,,
嘉定区嘉塘路515号,上海市,嘉定区,121.2653,31.375602,嘉塘公路红菱摩托修理部,上海市,,
宝山区陈川路210号,上海市,宝山区,121.339785,31.479329,宝山区周进自行车商店,上海市,,
浦东新区芦潮港镇渔港路70号,上海市,浦东新区,121.848509,30.876325,瞿军(直营),上海市,,
闸北区文喜路601号,上海市,静安区,121.45632,31.308262,晓徐车行,上海市,,
128纪念路601号,上海市,宝山区,121.454903,31.327078,一二八纪念路,上海市,,
闸北区长江西路2311号,上海市,宝山区,121.436044,31.329255,钱森商贸有限公司(直营),上海市,,
南汇区古恩路42号,上海市,浦东新区,121.644707,31.073174,新世纪摩托车商店,上海市,,
浦东新区晨阳路68号,上海市,浦东新区,121.748138,31.175553,上海尚品电动车(直营),上海市,,
上海浦东新区永泰路1466号,上海市,浦东新区,121.531709,31.144085,上海随发贸易有限公司(直营),上海市,,
上海市宝山区长江路550-14号一层,上海市,宝山区,121.488537,31.348543,上海市宝山区超威百货经营部(直营),上海市,,
上海市浦东新区机场镇施湾三路982-11号,上海市,浦东新区,121.751187,31.14267,上海市浦东新区机场镇施湾三路王伟电动车行(直营),上海市,,
上海市长宁区剑河路2247号,上海市,长宁区,121.373183,31.19341,上海市长宁区正东车行(直营),上海市,,
上海市闵行区莘北路54号,上海市,闵行区,121.374011,31.114679,上海市闵行区宏昊电动车经营部,上海市,,
松江区车墩镇车香路210号,上海市,松江区,121.285655,31.005631,阳聪电动车维修经营部(直营),上海市,,
上海市奉贤区泰日镇大叶公路东100米（与泰青路交口）,上海市,奉贤区,121.570025,30.917447,上海市奉贤区泰日镇佳男自行车修理部(直营),上海市,,
上海市青浦区赵重公路3014-3016号,上海市,青浦区,121.185009,31.200705,上海青浦区重固镇小朱电动车经营部(直营),上海市,,
上海市松江区叶榭镇叶新公路105-2号,上海市,松江区,121.318283,30.94663,上海市松江区叶榭镇赵年电动车经营部(直营),上海市,,
上海市松江区叶榭镇张泽镇南路和竹亭路口,上海市,松江区,121.275134,30.932679,上海市松江区叶榭镇建定摩托车经营部(直营),上海市,,
上海市金山区朱漕公路珠港街181-185号,上海市,金山区,121.342305,30.847108,上海市金山区龙辉车行(直营),上海市,,
上海市青浦区华新镇华富街17-19号,上海市,青浦区,121.23495,31.24446,上海市青浦区华新镇孙书英电动车经营部(直营),上海市,,
九亭镇涞坊路237号,上海市,松江区,121.319534,31.15432,上海市九亭镇松毅电动车行,上海市,,
九新公路同利路金汇商业街69号,上海市,松江区,121.3153,31.1085,新驰贸易有限公司,上海市,,
松江区九杜路16号,上海市,松江区,121.314095,31.13704,川行车行(直营),上海市,,
上海市闵行区闸航路2503号,上海市,闵行区,121.53716,31.01936,上海市闵行区浦江镇敬李电动车经营部(直营),上海市,,
上海奉贤区南奉公路9310-9312号,上海市,奉贤区,121.466471,30.912793,上海盟锋摩托车经营部,上海市,,
上海市金山区金山卫镇学府路700号,上海市,金山区,121.322805,30.730096,上海大童摩托车销售有限公司(直营),上海市,,
金山区朱泾镇罗星路80号,上海市,金山区,121.169559,30.895254,上海为娣摩托车销售有限公司(直营),上海市,,
奉贤区四团镇川南奉公路8320号,上海市,奉贤区,121.717083,30.9385,上海市奉贤区永淘车行(直营),上海市,,
奉贤区拓林镇沪杭公路3379号,上海市,奉贤区,121.473043,30.82674,上海市奉贤区诚厚车行(直营),上海市,,
上海青浦区赵巷镇赵华路426号,上海市,青浦区,121.198822,31.15191,上海易本摩托车有限公司(直营),上海市,,
上海市闵行区浦江镇沈杜路与三鲁公路交叉路口,上海市,闵行区,121.523102,31.076325,闵行区佳龙摩托车配件商店(直营),上海市,,
青浦区盈港路205号,上海市,青浦区,121.12032,31.158737,上海惠泉实业有限公司（青浦区）(直营),上海市,,
松江区泗泾镇鼓浪路297-299号,上海市,松江区,121.278077,31.115837,上海市松江区泗泾镇广清电动车行,上海市,,
上海松江区松汇中路1058号,上海市,松江区,121.223296,31.003943,上海鑫炎电动车有限公司(直营),上海市,,
周浦镇,上海市,浦东新区,121.58151447772977,31.104818494956614,周浦新日,上海市,,
航头镇,上海市,浦东新区,121.60020947456363,31.081910884441683,鹤沙路新日,上海市,,
东港公路与牛肚支路交叉口东北50米,上海市,浦东新区,121.833428,31.041334,中港新日,上海市,,
大团镇,上海市,浦东新区,121.75768733024603,30.991115082121553,上海炫琴贸易有限公司,上海市,,
平阳路1018号,上海市,闵行区,121.392664,31.136839,花桥新日电动车,上海市,,
上海市闸北区场中路2161号,上海市,静安区,121.450132,31.305857,上海雅芹汽配有限公司,上海市,,
上海奉贤黄庙区南奉公路9413号,上海市,奉贤区,121.46599,30.91235,上海阳悦金属制品厂,上海市,,
上海市浦东新区曹路镇海鸣路82号,上海市,浦东新区,121.67127,31.28352,上海市浦东新区曹路镇鸣钻电动自行车店,上海市,,
惠南镇,上海市,浦东新区,121.76304370164874,31.05205506373423,上海娇驰摩托车销售有限公司,上海市,,
上海金山区朱泾镇万安街232号,上海市,金山区,121.166614,30.896834,上海市金山区李意红电动车经营部(直营),上海市,,
上海市浦东新区曹路镇民春路237号,上海市,浦东新区,121.66194,31.274021,上海市浦东新区曹路镇安乐家电商店,上海市,,
川沙新镇,上海市,浦东新区,121.69865861535074,31.190103489089662,川沙镇新日,上海市,,
上海市浦东新区张扬路1711号,上海市,浦东新区,121.5798,31.256508,上海紫风电动车有限公司,上海市,,
洋泾街道,上海市,浦东新区,121.54618844389917,31.236960601280995,张扬路门店,上海市,,
上海市中山北路966号,上海市,普陀区,121.452861,31.258608,上海博律五金机电有限公司,上海市,,
上海市金山区金山工业区朱林路22-24号,上海市,金山区,121.336261,30.844803,上海市金山区鹏程电动车商店,上海市,,
上海市闵行区锦梅路646-730号第15间,上海市,闵行区,121.425849,31.1162,上海市闵行区伟忠车行,上海市,,
上海市虹口区水电路645弄14号(651号）,上海市,虹口区,121.47629,31.282,上海庚烁贸易商行,上海市,,
上海嘉定区嘉罗公路465号,上海市,嘉定区,121.261734,31.385098,上海欧滨贸易有限公司,上海市,,
上海市宝山区牡丹江路568-570号,上海市,宝山区,121.494246,31.385637,上海健茂贸易有限公司,上海市,,
上海市宝山区锦秋路984号,上海市,宝山区,121.386449,31.319952,上海遇申贸易有限公司,上海市,,
上海市闵行区莘庄工业区申北路595号,上海市,松江区,121.376161,31.0879,上海市闵行区荆芡车行,上海市,,
上海市闵行区七宝镇沪松公路199号,上海市,闵行区,121.344635,31.152463,上海琴通电动车有限公司,上海市,,
青浦区盈港路235号,上海市,青浦区,121.119682,31.158898,上海乐环实业有限公司,上海市,,
上海市浦东新区高东镇园一路120号,上海市,浦东新区,121.632004,31.317443,上海市浦东新区高东镇张家宅摩托车修理部,上海市,,
上海市浦东新区航头镇富航路26号,上海市,浦东新区,121.597246,31.029545,上海明龙投资管理有限公司,上海市,,
上海市浦东新区凌桥镇江东路1463号,上海市,浦东新区,121.536211,31.367726,上海市浦东新区高桥镇栋风电动车经营部,上海市,,
上海市徐汇区宛平路865号,上海市,徐汇区,121.445015,31.198141,上海骋骏商贸有限公司,上海市,,
张堰镇,上海市,金山区,121.28940179944041,30.807297889803444,金山区张堰镇新日,上海市,,
金山卫镇,上海市,金山区,121.3217103481293,30.730713141529154,金山区金山卫新日,上海市,,
上海市浦东新区龚华路新日电动车专卖店,上海市,浦东新区,121.686211,31.261898,上海大个子实业发展有限公司,上海市,,
宛平南路909弄,上海市,徐汇区,121.452654,31.184403,新日电动车,上海市,,
上海市宝山区爱辉路211号,上海市,宝山区,121.454826,31.332761,上海鳌忝贸易有限公司,上海市,,
张江镇,上海市,浦东新区,121.6327875852585,31.178660097523885,军民路,上海市,,
提篮桥街道,上海市,虹口区,121.49243429303168,31.253318931887286,来来来助动车,上海市,,
塘桥街道,上海市,浦东新区,121.51518613100056,31.211056889294102,塘桥,上海市,,
