address,city,districd,lat,lon,name,province,street,town
吉林省敦化市翰章大街建筑公司楼下,延边朝鲜族自治州,敦化市,128.233047,43.366447,敦化市老五摩托车经销处,吉林省,,
吉林省榆树市榆树大街北段新日电动车专卖店,长春市,榆树市,126.560891,44.828229,榆树市新日电动车行,吉林省,,
吉林省德惠市东五道街（新日专卖店）,长春市,德惠市,125.712617,44.548708,德惠市东盛新能源汽车销售服务有限公司,吉林省,,
吉林省东丰县林业局对面新日电动车,辽源市,东丰县,125.540905,42.674994,东丰镇小龙摩托车行,吉林省,,
松原市江南国贸西行100米,松原市,宁江区,124.825117,45.141789,松原市宁江区美日电动车商店,吉林省,,
"吉林省白城市幸福南大街42号新日专卖店自提：88086641\n', '自提：13812027778",白城市,洮北区,122.827772,45.611897,白城市新日电动车专卖店,吉林省,,
吉林省白城市通榆县商业城北30米路西新日专卖店(自提)司机:8385206,白城市,通榆县,123.088239,44.812911,通榆县大利电动车商行,吉林省,,
吉林镇赉县团结东路新日专卖店,白城市,镇赉县,123.205635,45.851913,镇赉县镇赉镇大陆鸽电动车行,吉林省,,
吉林省大安市安泰市场西数3门,白城市,大安市,124.291406,45.511225,大安市大阳电瓶车商店一分店,吉林省,,
吉林市船营区南京街吉林大街224号,吉林市,船营区,126.565799,43.846867,吉林市船营区吉利电动车经销部,吉林省,,
吉林省梅河口市梅河大街2202号,通化市,梅河口市,125.682428,42.526096,梅河口市文斌车行,吉林省,,
吉林省洮南市富文东路,白城市,洮南市,122.800402,45.345149,洮南市顺发电动车商店,吉林省,,
长春市南关区大马路643号,长春市,南关区,125.341363,43.891256,吉林省大方向电动自行车有限公司,吉林省,,
吉林省辽源市龙山区实验小学后侧,辽源市,龙山区,125.13896,42.899733,辽源市龙山区英子车行(直营),吉林省,,
吉林省长春市南关区大马路582号,长春市,南关区,125.340284,43.89766,南关区新日电动车专卖店(直营),吉林省,,
吉林省通化市建设大街纺织配件1号楼4号门市下,通化市,东昌区,125.965866,41.738486,通化辛升摩托车销售有限公司(直营),吉林省,,
吉林省珲春市站前西大街1426号,延边朝鲜族自治州,珲春市,130.353536,42.876625,珲春立信贸易有限公司(直营),吉林省,,
吉林省四平市伊通县西门道北,四平市,伊通满族自治县,125.305394,43.345754,伊通满族自治县伊通镇伟东凤凰电动车专卖店(直营),吉林省,,
吉林省蛟河市蛟河大街泰林综合楼3号门市,吉林市,蛟河市,127.346683,43.723093,蛟河市新日电动车行,吉林省,,
吉林省桦甸市大兴街489号（收货地址：桦甸市大兴街与金城路交汇，三中对面西100米）,吉林市,桦甸市,126.740238,42.968084,桦甸市明华街雅迪电动车商店,吉林省,,
吉林省四平市梨树县梨树镇东买卖大街49号103-203室,四平市,梨树县,124.352325,43.314296,梨树县高赵电动车行(直营),吉林省,,
吉林省四平市南一经街1047号,四平市,铁东区,124.37881,43.16175,四平市铁西区星工场日用品商行(直营),吉林省,,
吉林省四平伊通县畜牧局路北新日电动车,四平市,伊通满族自治县,125.292922,43.344074,伊通满族自治县阳光电动车行(直营),吉林省,,
南环辽河大路6592号鑫鑫摩托车有限公司,辽源市,龙山区,125.138535,42.899372,辽源市龙山区鑫鑫摩托车销售有限公司(直营),吉林省,,
通化市新胜路331号,通化市,东昌区,125.966907,41.74272,通化市长白山摩托车销售有限公司(直营),吉林省,,
长岭县龙达大厦道南,松原市,长岭县,123.978233,44.27652,长岭县长岭镇岭城新日电动车商店(直营),吉林省,,
吉林省延边和龙市民安街烟草公司北侧,延边朝鲜族自治州,和龙市,129.005809,42.540383,吉林和龙市聚运达电动车店(直营),吉林省,,
吉林省四平市梨树县中医院西侧,四平市,梨树县,124.32422,43.31032,梨树县梨树镇新日电动车专卖店(直营),吉林省,,
吉林省大安市锦华路101号,白城市,大安市,124.291842,45.511189,大安市新日电动车(直营),吉林省,,
吉林省洮南市广播电视台路北50米新日专卖店自提:83857006,白城市,洮南市,122.782382,45.333575,洮南市同顺电动车商店(直营),吉林省,,
吉林省扶余县兴华路,长春市,农安县,125.184963,44.4308,吉林省扶余县大长江摩托车有限公司(直营),吉林省,,
白山市浑江大街313-9号,白山市,浑江区,126.404994,41.924773,吉林省白山市福星摩托车销售有限公司(直营),吉林省,,
吉林通化市柳河县柳河大街476号,通化市,柳河县,125.73117,42.277374,柳河县柳河镇新日电动车行,吉林省,,
通化市建设大街81号,通化市,东昌区,125.968974,41.740864,吉林省通化市新兴摩托车销售有限公司(直营),吉林省,,
吉林省九台市站前路62号（电影院内）,长春市,九台区,125.833736,44.153615,九台市连耀摩托车经销有限公司(直营),吉林省,,
长春市玉山路双阳商都西侧,长春市,双阳区,125.667996,43.525736,长春市双阳区龙辉灯饰批发城(直营),吉林省,,
吉林省吉林市吉林大街296号,吉林市,船营区,126.566417,43.855708,吉林市船营区保文电动车行,吉林省,,
吉林省磐石市国税局道东农村信用联社楼下（阜康大道984号）,吉林市,磐石市,126.061774,42.948096,磐石市东宁街草草十字绣商店,吉林省,,
吉林省蛟河市民主路2-2号,吉林市,蛟河市,127.340136,43.723327,吉林省蛟河市思奇摩托车销售有限公司(直营),吉林省,,
吉林市舒兰市河南路60号,吉林市,舒兰市,126.949642,44.406596,舒兰市新日电动车专卖店(直营),吉林省,,
桦甸市莲花路123号,吉林市,桦甸市,126.740656,42.976245,吉林省桦甸市胜利街国贸商厦世斌衬衫柜(直营),吉林省,,
吉林省珲春市靖合街检察院公寓104号,延边朝鲜族自治州,珲春市,130.36729,42.876532,珲春市万波摩托车商店,吉林省,,
吉林省长春市农安县凯德花园12号206新日专卖,长春市,农安县,125.175801,44.422213,吉林长安天虹电动车行(直营),吉林省,,
公主岭市五区客运站对面新日专卖店,四平市,铁西区,124.3725,43.16775,公主岭市新日电动车商店,吉林省,,
吉林省四平市铁东南一马路4-5纬间,四平市,铁东区,124.379302,43.161682,四平市铁东区恒业电动车大世界,吉林省,,
朝阳区东坝东五环汽配城对面“新日电动车专卖店”,长春市,朝阳区,125.288319,43.833513,北京生茂科贸有限公司,吉林省,,
017县道(岔路口镇人民政府东),长春市,德惠市,126.189351,44.639615,德惠市岔路口,吉林省,,
海龙镇胜利街西处二商店左侧100米处附近,通化市,梅河口市,125.85574,42.652015,梅河口海龙镇,吉林省,,
大兴街与金城路交叉口东50米,吉林市,桦甸市,126.740106,42.967973,吉林桦甸新日专卖店,吉林省,,
吉林省珲春市教师进修学校楼下新日电动车(口岸大路1706号）,延边朝鲜族自治州,珲春市,130.353279,42.862874,珲春市万波摩托车商店,吉林省,,
吉林省长春市南关区大马路882号永春G区H门市房,长春市,南关区,125.341518,43.895703,南关区永遇电动车经销处,吉林省,,
吉林省长春市九台区九台街道站前路1号,长春市,九台区,125.837104,44.150841,九台新艺电动车,吉林省,,
吉林省白城市洮北区西郊街道铁岭王,白城市,洮北区,122.777053,45.553081,石宁车城,吉林省,,
吉林省白城市洮北区东风乡009乡道,白城市,洮北区,122.818282,45.674336,平安镇金鹏电动车,吉林省,,
吉林省白城市洮北区林海镇大兴村,白城市,洮北区,122.744234,45.527944,宝全车行,吉林省,,
吉林省辽源市东丰县猴石镇东丰县猴石镇人民政府,辽源市,东丰县,125.327766,42.641625,猴石镇宏亮摩托车行,吉林省,,
吉林省辽源市东丰县沙河镇中心路,辽源市,东丰县,125.625408,42.992323,万达家电摩托车商场,吉林省,,
吉林省辽源市东丰县大阳镇东丰县大阳镇中学,辽源市,东丰县,125.425358,42.504526,宏光车行,吉林省,,
吉林省辽源市东丰县大阳镇大阳镇人民政府,辽源市,东丰县,125.423278,42.504345,奥兴油电三轮车,吉林省,,
吉林省辽源市东丰县横道河镇横道河镇,辽源市,东丰县,125.294903,42.410847,小彭摩托车经销处,吉林省,,
吉林省辽源市东丰县小四平镇小四平镇人民政府,辽源市,东丰县,125.141036,42.541157,兴达摩托车行,吉林省,,
吉林省辽源市东丰县南屯基镇曾家街,辽源市,东丰县,125.382881,42.61949,真诚修理部,吉林省,,
吉林省长春市德惠市大青嘴镇德惠市大青咀镇派出所,长春市,德惠市,125.846819,44.42754,大青咀海龙车行,吉林省,,
吉林省长春市宽城区米沙子镇德惠市司法局米沙子司法所,长春市,宽城区,125.476049,44.129162,铃木摩托,吉林省,,
吉林省长春市农安县农安镇兴华路1555号龙苑小区(兴华路),长春市,农安县,125.184741,44.43289,农安县高家店镇德富摩托车配件商店,吉林省,,
吉林省辽源市东丰县东丰镇东丰县林业局东丰三中,辽源市,东丰县,125.540847,42.674949,东丰镇小龙摩托车行,吉林省,,
吉林省白城市洮南市通达街道富文东路,白城市,洮南市,122.800401,45.345148,洮南市顺发电动车商行,吉林省,,
吉林省吉林市船营区南京街道吉林大街306号宝丰名苑,吉林市,船营区,126.566437,43.856246,吉林市新日电动车,吉林省,,
吉林省延边朝鲜族自治州珲春市新安街道珲春市教师进修学校,延边朝鲜族自治州,珲春市,130.353492,42.862933,珲春市万波摩托车商店,吉林省,,
吉林省白城市镇赉县镇赉镇团结东路496号,白城市,镇赉县,123.210449,45.851887,镇赉县新日电动车,吉林省,,
吉林省松原市宁江区繁荣街道锦江大街168号马头琴公园,松原市,宁江区,124.81053,45.120244,松原市宁江区美日电动车商店,吉林省,,
吉林省长春市德惠市胜利街道新华街163号福临门宾馆(新华街),长春市,德惠市,125.710925,44.537466,德惠市东盛新能源销售服务有限公司,吉林省,,
吉林省长春市榆树市培英街道榆树大街复兴嘉园,长春市,榆树市,126.563961,44.831824,吉林榆树新日电动车,吉林省,,
吉林省通化市梅河口市新华街道梅河大街2202号文化大楼,通化市,梅河口市,125.682495,42.526084,梅河口市文斌车行,吉林省,,
吉林省白城市通榆县开通镇向海北街2744号,白城市,通榆县,123.082175,44.80742,通榆县大利电动车行,吉林省,,
吉林省白城市大安市临江街道锦华路,白城市,大安市,124.291842,45.511189,大安市大阳电瓶车商店一分店,吉林省,,
吉林省松原市乾安县乾安镇丹青街3-19铭星住建大厦,松原市,乾安县,124.044144,45.005595,乾安县诚信车行,吉林省,,
吉林省四平市梨树县喇嘛甸镇喇嘛甸村,四平市,梨树县,124.132674,43.293814,梨树县喇嘛甸镇曲雷摩托车修理部,吉林省,,
吉林省长春市农安县万金塔乡万金塔村,长春市,农安县,125.402208,44.614119,农安县万金塔乡司福来摩托车商店,吉林省,,
吉林省四平市双辽市服先镇服先村,四平市,双辽市,123.866277,43.958643,双辽市服先镇张龙车行,吉林省,,
米沙子镇,长春市,宽城区,125.47604978084564,44.129157332329896,德惠市米沙子,吉林省,,
岭下镇,白城市,洮北区,122.42323458194734,45.84587813486316,白城镇西,吉林省,,
渤海街道,延边朝鲜族自治州,敦化市,128.23398292064667,43.36890948192736,敦化市瀚章新日,吉林省,,
南城街道,吉林市,舒兰市,126.94733664393425,44.4074007881318,舒兰新日,吉林省,,
吉林省长春市宽城区兰家镇兴民路,长春市,宽城区,125.264812,44.025796,天桥岭新日,吉林省,,
