address,city,districd,lat,lon,name,province,street,town
四川省名山县红星镇百马街197号,成都市,武侯区,104.075931,30.651651,雅安市名山区星达车行,四川省,,
四川省泸州市龙马潭区金山路六和苑四号楼2号门市,泸州市,龙马潭区,105.438865,28.896478,李吉,四川省,,
乐山市市中区柏杨中路556号,乐山市,市中区,103.741007,29.591837,乐山市中心城区嘉乐摩托车行,四川省,,
四川省荥经县严道派出所旁,雅安市,荥经县,102.83575,29.794641,荥经县宏运摩托车销售点,四川省,,
四川省天全县电动车一条街门市,雅安市,天全县,102.767599,30.055918,天全县华龙车行,四川省,,
四川省攀枝花市米易县攀莲镇大坪北路,攀枝花市,米易县,102.102363,26.890067,米易县何氏商贸有限公司,四川省,,
四川省泸州市纳溪城区柏林小区2号楼第一层35号门市,泸州市,纳溪区,105.365974,28.766428,张诗权,四川省,,
四川省宜宾市商业街2号楼8号“北京新日专卖”发货地址:四川宜宾市难岩长江大道19-10号,宜宾市,翠屏区,104.626583,28.756438,宜宾奕星商贸有限公司,四川省,,
四川省南溪县北大街163号,成都市,彭州市,103.942072,30.987527,宜宾市南溪区唐泽均车行,四川省,,
四川省长宁县长宁镇竹都大道二段43号,宜宾市,长宁县,104.915553,28.579791,长宁县建国电动车行,四川省,,
四川省宜宾市珙县巡场镇芙蓉路大道75号,宜宾市,珙县,104.709291,28.458505,孙希兵,四川省,,
四川省内江市中区交通路166号,成都市,简阳市,104.520957,30.419353,内江市中区远大车行,四川省,,
四川荣县环城南路169号,自贡市,荣县,104.413752,29.454827,荣县环城三哥车行,四川省,,
四川省邻水县交警大队对面下50米,广安市,邻水县,106.93038,30.334769,邻水县万鑫电动车行,四川省,,
四川省武胜县下东街,广安市,武胜县,106.297055,30.344998,武胜县沿口胜仔电动车店,四川省,,
大竹县竹阳北路,达州市,大竹县,107.213055,30.736949,大竹县馨飞电动车销售门市,四川省,,
达州市达川区翠屏街通达西路389号,达州市,达川区,107.50382,31.20121,达州市达川区振男车行,四川省,,
四川省华蓥市双河镇明光路284号,广安市,华蓥市,106.773792,30.367604,刘建平,四川省,,
四川省营山县翠屏路金穗门口,南充市,营山县,106.562643,31.072064,营山县钟文车行,四川省,,
四川省遂宁市射洪县太和镇新阳街488号雅迪电动车专卖店,遂宁市,射洪县,105.380744,30.871051,任勇,四川省,,
四川省泸州泸县二中学府路34号,泸州市,泸县,105.373297,29.141478,泸县福集镇好弟兄电动车销售部,四川省,,
四川省凉山州西昌市长安中路安宁小区292号（北京新日专卖）,凉山彝族自治州,西昌市,102.248767,27.887948,西昌志彬电动车销售有限公司,四川省,,
四川省内江市威远县严陵镇杉树坳街中段320号,内江市,威远县,104.664391,29.519834,威远县恒瑞祥商贸有限公司,四川省,,
四川省峨眉山市符溪镇乐峨路符溪段26号1-7号,乐山市,峨眉山市,103.560945,29.599729,峨眉山市志春摩托车销售经营部,四川省,,
四川省自贡市自流井区汇东路市图书馆360号,自贡市,自流井区,104.770279,29.343876,自贡市继翔商贸有限公司,四川省,,
四川省自贡市富顺县斧江大道中段五羊本田,自贡市,富顺县,104.9708,29.18051,富顺县宏达摩托车经营部,四川省,,
会理县顺城路891号,凉山彝族自治州,会理县,102.248886,26.653898,会理县新能源电动车行,四川省,,
四川省乐山市五通桥区牛华镇豪爵铃木专卖店,乐山市,五通桥区,103.802914,29.464398,乐山市五通桥区驰骋车行,四川省,,
资中县前西街嘉陵摩托车行,内江市,资中县,104.853399,29.788898,资中县飞跃摩托车行,四川省,,
四川省南充市人民南路300-304号,南充市,顺庆区,106.080963,30.785046,南充金夫人电动车城,四川省,,
广安市广安区兴安东街22-24号,广安市,广安区,106.641608,30.474003,广安市城南兴安中街凯达自行车经营部,四川省,,
四川省广安市岳池县九龙镇九龙大街千禧家园门市（新日电动车专卖店）,广安市,岳池县,106.445699,30.531469,岳池县新日电动车经营部,四川省,,
四川省绵阳市长虹大道中段39号大兴达摩托车公司“北京新日专卖”,绵阳市,涪城区,104.737816,31.476933,四川大兴达摩托车有限责任公司,四川省,,
四川省广元市文化路,广元市,利州区,105.857438,32.429992,广元市城区宽宏摩托车经营部东坝店,四川省,,
四川省眉山市丹棱县西门大道,眉山市,丹棱县,103.512733,30.014448,丹棱县平安车行,四川省,,
四川省青神县青城镇福家小区22-23号,眉山市,青神县,103.841839,29.83118,青神县邓氏车业销售部一门市,四川省,,
四川省安岳县北大街279号,资阳市,安岳县,105.347711,30.108797,阳运建,四川省,,
四川巴中市巴州区南池南路540号,巴中市,巴州区,106.755631,31.848914,巴中市巴州区锦程电动车行,四川省,,
中江县凯江镇朝阳中路215号,德阳市,中江县,104.679474,31.030735,唐海芳,四川省,,
四川省资阳市雁江区松涛路一段213号,资阳市,雁江区,104.630679,30.148071,资阳市大地四海商贸有限责任公司,四川省,,
四川简阳市五友路二段新日电动车专卖店,成都市,简阳市,104.549422,30.394245,简阳市简城镇新新日电动车行,四川省,,
人民路新汽车站东邻,成都市,双流区,103.875763,30.58234,平顶山市玖晋源商贸有限公司,四川省,,
四川省成都市都江堰市青城桥头郦湾酒店对面,成都市,都江堰市,103.612376,30.977239,都江堰市高信摩托车行(直营),四川省,,
四川省成都市金牛区兴川路1027蚂蚁物流城北基,成都市,金牛区,104.100075,30.753435,金牛区洪诚电动自行车行,四川省,,
眉山市东坡区一环东路（巴黎春天对面）新日电动车,眉山市,东坡区,103.842152,30.043771,眉山市新兴摩托车销售有限公司,四川省,,
邛崃市临邛镇东街212号,成都市,邛崃市,103.466573,30.411524,沈正彬,四川省,,
四川省眉山市洪雅县三宝镇,眉山市,洪雅县,103.423194,29.832785,洪雅县余东车行,四川省,,
四川省德阳市旌阳区泰山北路一段76号,德阳市,旌阳区,104.394653,31.128979,德阳新日专卖店(直营),四川省,,
四川省眉山市东坡区一环东路团部对面,眉山市,东坡区,103.842506,30.051132,眉山市东坡区彭氏电器自行车行(直营),四川省,,
四川成都市新都区新繁镇白鹤街东段8-10号,成都市,新都区,104.007569,30.878267,成都市诚吉商贸有限公司(直营),四川省,,
四川眉山市凤鸣百路462号,眉山市,东坡区,103.848538,30.075439,四川彭山县大余摩托车凤鸣百路经营部(直营),四川省,,
四川眉山市一环西路463号,眉山市,东坡区,103.82257,30.04593,眉山市东坡区金典车行(直营),四川省,,
四川省眉山市东坡区一环西路,眉山市,东坡区,103.821434,30.044845,眉山新日电动车专卖店,四川省,,
绵竹市瑞祥路27号,德阳市,绵竹市,104.194732,31.34298,四川绵竹市（王倩）(直营),四川省,,
四川省都江堰市青城路49号,成都市,都江堰市,103.631742,30.983484,四川省都江堰万丰车行(直营),四川省,,
四川成都金堂县淮口镇淮州大道127—129号,成都市,金堂县,104.563065,30.711996,金堂淮口唐氏车行,四川省,,
四川省仁寿县文林镇陵州路二段299号,眉山市,仁寿县,104.1567,29.989994,四川省仁寿县（孙敏丽）(直营),四川省,,
德阳市泰山北路三段秦密村,德阳市,旌阳区,104.396329,31.154963,德阳超美车业有限公司(直营),四川省,,
四川省中江县朝阳中路104号,德阳市,中江县,104.68094,31.034641,中江县银鑫五交化标件经营部(直营),四川省,,
四川德阳绵竹市剑南镇瑞祥路24号,德阳市,绵竹市,104.198823,31.347545,绵竹市新日专卖店(直营),四川省,,
资阳市西门松涛红绿灯路口,资阳市,雁江区,104.627636,30.128901,四川资阳新日专卖店(直营),四川省,,
简阳五友路二段118号,成都市,简阳市,104.549422,30.394245,四川简阳新日专卖店,四川省,,
四川省洪雅县青云街76号新日专卖店,眉山市,洪雅县,103.37795,29.901635,四川省洪雅县新日专卖店(直营),四川省,,
四川省武胜县六十米大街新日专卖店,广安市,武胜县,106.295764,30.348772,四川省武胜县新日专卖店(直营),四川省,,
四川省广安邻水县万兴大道33-34号,广安市,邻水县,106.929836,30.330848,四川邻水县新日专卖店(直营),四川省,,
四川省大竹县竹阳北路338号,达州市,大竹县,107.215081,30.738384,大竹县新日电动车车行(直营),四川省,,
四川达州渠县渠红镇渠光路133号,达州市,渠县,106.968101,30.828817,四川省达州渠县新日专卖店(直营),四川省,,
四川省达州市南外通达西路512号,达州市,达川区,107.502478,31.203136,达州新日电动车专卖店(直营),四川省,,
四川省遂宁市天宫北路开元驾校斜对面,遂宁市,船山区,105.592567,30.496826,四川遂宁船山区大运车行(直营),四川省,,
四川省遂宁市大英县客馆街新日专卖店,遂宁市,大英县,105.258376,30.576808,遂宁市大英县新日电动车店(直营),四川省,,
四川省阆中市保宁醋西路19号新日电动车店,南充市,阆中市,105.985872,31.57505,阆中新日电动车专卖店(直营),四川省,,
四川郫县一里阳光街5号,成都市,郫都区,103.89191,30.80972,郫县智业电动车配件维修中心(直营),四川省,,
四川省城市武侯区置信丽都花园小区366-3号,成都市,武侯区,104.063375,30.620208,四川省成都办事处(直营),四川省,,
四川省成都市温江区柳城凤溪大道北段539号2栋1楼,成都市,温江区,103.828643,30.69967,温江盛达电动车经营部(直营),四川省,,
四川省射洪县沱牌大道繁荣公寓门面房,遂宁市,射洪县,105.372592,30.863936,射洪县华辉摩托车有限责任公司(直营),四川省,,
四川省成都西南摩托车展销中心（双流九江）,成都市,双流区,103.920603,30.632581,四川成都新日电动车销售旗舰店(直营),四川省,,
自贡市富顺县富顺镇釜江大道中段480号1栋1层36号,自贡市,富顺县,104.968259,29.181069,富顺县新日电动车专卖店(直营),四川省,,
四川省渠县渠江镇营渠路,达州市,渠县,106.968346,30.844114,渠江镇玫瑰之约电动车门市(直营),四川省,,
四川省阆中市保宁醋西街,南充市,阆中市,105.983261,31.574408,阆中市春雷贸易有限公司(直营),四川省,,
四川省渠县营渠路131路,达州市,渠县,106.968346,30.844114,渠县新日专卖店(直营),四川省,,
成都高新区中和镇柳荫街64号新日电动车,成都市,双流区,104.091063,30.557405,成都高新区中和镇新日电动车专卖店(直营),四川省,,
四川成都市金牛区五块石电器市场C座三楼,成都市,金牛区,104.066587,30.708666,四川成都五块石新日电动车专卖店,四川省,,
四川达州渠县营渠路65号,达州市,渠县,106.968346,30.844114,渠江镇绿佳电动车(直营),四川省,,
四川省射洪县太和镇城信花园繁荣公寓小区,遂宁市,射洪县,105.379326,30.851862,四川射洪新日专卖店,四川省,,
四川省阆中市保宁醋西街25号,南充市,阆中市,105.983261,31.574408,阆中新日电动车专卖店(直营),四川省,,
四川成都温江区凤溪大道北段549号,成都市,温江区,103.827965,30.702162,四川成都温江新日专卖店(直营),四川省,,
四川广安华蓥市明光路269号,广安市,华蓥市,106.775491,30.371779,华蓥市鸿攀摩托车商行(直营),四川省,,
雅安市雨城南四路7号,雅安市,雨城区,102.994827,29.996278,雅安市雨城区森林车行(直营),四川省,,
四川省成都市华阳镇正东下街79-89号,成都市,双流区,104.066147,30.501098,双流县华阳万和摩托车商场(直营),四川省,,
芦山县平安路65,雅安市,芦山县,102.9288,30.144851,四川省芦山县永盛车行,四川省,,
汉源县九襄镇兴襄路3号,雅安市,汉源县,102.625276,29.498235,汉源县添运车行经营部,四川省,,
雅安市名山区陵园路180号,雅安市,名山区,103.109418,30.07976,四川雅安名山新日专卖店(直营),四川省,,
雅安市名山区,雅安市,名山区,103.109185,30.069954,攀枝花市金宸商贸有限责任公司(直营),四川省,,
四川省崇州市崇阳镇蜀州中路371号,成都市,崇州市,103.669298,30.623721,崇州市崇阳鹏飞电动车门市(直营),四川省,,
四川省双流县藏卫路南一段211-218,成都市,双流区,103.920809,30.565482,四川双流简四摩托车销售有限公司,四川省,,
四川省双流县中和镇柳萌街74-76号,成都市,双流区,104.09215,30.55843,四川省双流县中和镇（李春风）(直营),四川省,,
四川大邑县晋原镇东壕沟南段6号新日专卖,成都市,大邑县,103.524054,30.586107,四川大邑县新日专卖店(直营),四川省,,
四川省新津县黄鹤大道77号,成都市,新津县,103.799918,30.414682,四川新津县新日专卖店(直营),四川省,,
四川邛崃市临邛镇长安大道313号,成都市,邛崃市,103.480257,30.410326,临邛玉祥机车部件经营部(直营),四川省,,
四川省峨眉山市胜利镇名山路东段2号附14号,乐山市,峨眉山市,103.510624,29.593709,峨眉山市盛大摩托车有限公司(直营),四川省,,
四川省眉山市东坡区一环西路,眉山市,东坡区,103.821434,30.044845,眉山市奔腾摩托销售有限公司(直营),四川省,,
四川省筠连县筠连镇筠州南路160号,宜宾市,筠连县,104.505591,28.157545,四川省筠连县双贵摩托车行(直营),四川省,,
四川省宜宾市江安县竹海路东段,宜宾市,叙州区,104.643215,28.751768,四川省江安县安尔达电动车修理销售店(直营),四川省,,
四川省宜宾市高县庆符路硕勋路9号,宜宾市,高县,104.516256,28.432862,高县新日电动车专卖店(直营),四川省,,
四川省兴文县古宋镇（县城）建国大道地税局门市38号,宜宾市,兴文县,105.24916,28.308271,四川兴文县富强电动车(直营),四川省,,
四川省自贡市汇东路西段雄飞家电底楼1号,自贡市,大安区,104.751213,29.333242,四川省自贡市汇东新区雨雷车行(直营),四川省,,
四川省自贡市荣县旭阳镇南街114号,自贡市,荣县,104.42321,29.454691,四川省自贡市荣县（穆祥荣）(直营),四川省,,
四川省富顺县釜江大道西段检察院综合楼底楼,自贡市,富顺县,105.005218,29.182768,四川富顺县新日专卖店,四川省,,
四川省夹江县焉城镇迎春南路319号,乐山市,夹江县,103.583238,29.735866,四川省夹江县新日专卖店(直营),四川省,,
四川乐山市中区苏稽大道674号,成都市,武侯区,104.075931,30.651651,乐山市市中区伟志车行(直营),四川省,,
四川省乐山市五通桥区中心路兄弟车行,乐山市,五通桥区,103.814195,29.409124,乐山市五通桥区兄弟车行(直营),四川省,,
四川省雅安市雨城区康藏路504号,雅安市,雨城区,102.994776,29.996922,四川省雅安市（曾修林）(直营),四川省,,
四川雅安芦山县先锋路10号,雅安市,芦山县,102.9271,30.143796,芦山县新日专卖店(直营),四川省,,
四川省内江市威远县三河路331—335号,内江市,威远县,104.661516,29.514825,四川省威远县江大电动摩托车行(直营),四川省,,
四川省隆昌县金鹅镇新华街506号门面,内江市,隆昌市,105.293672,29.340784,四川省隆昌县新日专卖店(直营),四川省,,
棬子路159号,内江市,市中区,105.067996,29.574728,内江市中区远大车行,四川省,,
九里堤街道,成都市,金牛区,104.03947323560716,30.708449148202117,金牛区洪诚电动自行车行,四川省,,
草堂北路2号附2-3号,成都市,青羊区,104.029111,30.662942,草堂新日电动车,四川省,,
城北街道,绵阳市,涪城区,104.74626749753953,31.466606695677946,绵阳成绵路新日店,四川省,,
东坝街道,广元市,利州区,105.84446847438812,32.432124503761905,广元新日电动车旗舰店,四川省,,
安阜街道,宜宾市,翠屏区,104.61081862449647,28.78117861372873,宜宾江北新日,四川省,,
西城街道,巴中市,巴州区,106.7556095123291,31.849102818798183,巴中新日电动车,四川省,,
南城街道,宜宾市,翠屏区,104.62665706872943,28.761217885837933,宜宾弈星商贸有限公司,四川省,,
富世镇印花庄社区釜江大道中段398号,自贡市,富顺县,104.969865,29.18064,富顺宏达摩托车经营部,四川省,,
福集镇,泸州市,泸县,105.37369117140773,29.14857844171819,泸县福集镇好弟兄电动车销售部,四川省,,
苏祠街道,眉山市,东坡区,103.84205460548401,30.04384839747448,眉山新日电动车,四川省,,
通惠街道,眉山市,东坡区,103.82380887866022,30.048505887223264,青神新日电动车,四川省,,
学苑街道,自贡市,大安区,104.76234734058382,29.336666886401574,自贡市继翔商贸有限公司,四川省,,
临邛镇,成都市,邛崃市,103.46786230802537,30.410675384209505,邛崃新日电动车,四川省,,
三宝镇,眉山市,洪雅县,103.4223371744156,29.831626823727476,洪雅新日电动车,四川省,,
丹棱镇,眉山市,丹棱县,103.50593090057373,30.016113691071382,丹棱新日电动车,四川省,,
南溪街道,宜宾市,南溪区,104.97391864657402,28.839409650896613,宜宾市南溪区唐泽均车行,四川省,,
江安镇,宜宾市,江安县,105.0757044553757,28.725026103236576,江安,四川省,,
长宁镇,宜宾市,长宁县,104.91735354065897,28.578627464437513,长宁县建国电动车行,四川省,,
巡场镇,宜宾市,珙县,104.71159324049948,28.444845824473305,孙希兵,四川省,,
九支镇,泸州市,合江县,105.68907871842386,28.583795112788394,赤水市新日电动车,四川省,,
红星镇,雅安市,名山区,103.28563168644908,30.151365165083444,雅安市名片区星达车行,四川省,,
严道镇,雅安市,荥经县,102.83621147274971,29.79508019973979,荥经县宏运摩托车销售点,四川省,,
城厢镇,雅安市,天全县,102.74877816438676,30.068238582993132,天全县华龙车行,四川省,,
柏杨街道,乐山市,市中区,103.74087631702426,29.59163246338881,乐山市中心城区嘉乐摩托车行,四川省,,
绥山镇,乐山市,峨眉山市,103.48775491118433,29.59168027676971,峨眉山市志春摩托车销售经营部,四川省,,
大兴街与42县道交叉口东北150米,重庆市,合川区,106.139039,30.318351,武胜兴隆镇分销,重庆市,,
重龙镇,内江市,资中县,104.84872654080391,29.777818076240482,资中县飞跃摩托车行,四川省,,
小市街道,泸州市,龙马潭区,105.43893858790398,28.896884859655604,李吉,四川省,,
安富街道,泸州市,纳溪区,105.36904558539392,28.767627364936345,张诗权,四川省,,
严陵镇,内江市,威远县,104.66383248567583,29.518429292240334,威远县恒瑞祥商贸有限公司,四川省,,
攀莲镇,攀枝花市,米易县,102.10222363471985,26.890279751592274,米易县何氏商贸有限公司,四川省,,
城关镇,凉山彝族自治州,会理县,102.24869906902313,26.66311687687941,会理县新能源电动车行,四川省,,
岳阳镇,资阳市,安岳县,105.34985035657883,30.109861662649287,安岳新日电动车,四川省,,
西城街道,凉山彝族自治州,西昌市,102.24915638566019,27.888006677315083,西昌市凌动电瓶车销售有限公司,四川省,,
四川省自贡市荣县旭阳镇二佛路136号,自贡市,荣县,104.419776,29.451992,荣县旭阳镇罗兵摩托车经营部,四川省,,
简城街道办事处正中街39号,成都市,简阳市,104.549139,30.39306,简阳新日电动车,四川省,,
三贤祠街道,资阳市,雁江区,104.63583558797838,30.122232649637205,资阳新日电动车旗舰店,四川省,,
吉祥街与飞龙北路交叉口东50米,广安市,武胜县,106.39539,30.416621,飞龙新日,四川省,,
凯江镇,德阳市,中江县,104.67883005738261,31.03018854926599,中江新日电动车专卖店,四川省,,
白马镇,眉山市,东坡区,103.72989267110826,30.054516650714753,白马新日电动车,四川省,,
三苏乡,眉山市,东坡区,103.61932128667831,30.049065421355884,三苏新日电动车,四川省,,
万胜镇,眉山市,东坡区,103.62280413508417,30.083933713515044,万胜新日电动车,四川省,,
多悦镇,眉山市,东坡区,103.72791051864624,30.160305700213673,多悦新日电动车,四川省,,
思蒙镇,眉山市,东坡区,103.74424517154696,29.928420952537852,思蒙新日电动车,四川省,,
旭阳镇,自贡市,荣县,104.4225811958313,29.445868007877735,荣县旭杨镇罗兵摩托车经营部,四川省,,
严道镇,雅安市,荥经县,102.83469200134277,29.794472683131968,荥经县宏运摩托车销售点,四川省,,
城厢镇,雅安市,天全县,102.75752753019333,30.065548203468307,天全县华龙车行,四川省,,
蒙顶山镇,雅安市,名山区,103.0968202650547,30.063734071075416,名山区新日,四川省,,
潮河镇,泸州市,泸县,105.271467,29.075556,泸县瓦子镇,四川省,,
天兴镇,泸州市,泸县,105.29128566384318,29.10398568488486,泸县天兴镇,四川省,,
方洞镇雨锋村,泸州市,泸县,105.43601,29.29985,雨坛镇,四川省,,
云龙镇,泸州市,泸县,105.4869206249714,29.057459244993385,泸县云龙镇,四川省,,
云锦镇,泸州市,泸县,105.65024033188821,29.080336559726536,泸县云锦镇,四川省,,
柳城街道,成都市,温江区,103.82942944765091,30.699226607298932,新日温江,四川省,,
顺庆区,南充市,顺庆区,106.086208,30.789607,南充新日电动车,四川省,,
射洪县,遂宁市,射洪县,105.381902,30.870629,射洪雅迪电动车,四川省,,
大竹县,达州市,大竹县,107.213055,30.736949,大竹新日,四川省,,
泰宁路,达州市,达川区,107.504785,31.171633,达州新日电动车,四川省,,
万兴中路与人民路南段交叉口东北50米,广安市,邻水县,106.92585,30.325831,邻水新日电动车,四川省,,
广宁北路172号(区地税局旁),广安市,广安区,106.633926,30.460979,广安新日电动车,四川省,,
九龙大街325号(千僖家园西北),广安市,岳池县,106.445938,30.531612,岳池新日电动车,四川省,,
武胜县,广安市,武胜县,106.296505,30.34499,武胜新日电动车,四川省,,
前进大道30号,广安市,岳池县,106.500478,30.468113,石垭新日,四川省,,
顾兴大街与顾兴街交叉口北100米,广安市,岳池县,106.46619,30.65938,顾县新日电动车,四川省,,
大兴街与42县道交叉口西50米,重庆市,合川区,106.137902,30.317632,兴隆新日电动车,重庆市,,
武胜县,广安市,武胜县,106.158081,30.401781,钟鸣新日,四川省,,
沿口镇五十米大街,广安市,武胜县,106.294435,30.342035,武胜沿口新日,四川省,,
安汉路九龙泉超市附近,南充市,高坪区,106.11915,30.778404,南充顾镇,四川省,,
营山县,南充市,营山县,106.798291,31.116177,营山石萍镇新日,四川省,,
黄舣镇,泸州市,江阳区,105.57147592306137,28.888375629527705,黄舣,四川省,,
大西街与烟市街交叉口东南150米,德阳市,绵竹市,104.32219,31.41633,河清新日电动车,四川省,,
滨河西路228,巴中市,南江县,106.82969,32.34518,阳和镇,四川省,,
恩野路与魁字湾二街交叉口西150米,巴中市,恩阳区,106.626462,31.792135,庆华镇新日电动车,四川省,,
将军乡高岩村7组,眉山市,洪雅县,103.38945,29.884281,将军乡新日电动车,四川省,,
三宝镇,眉山市,洪雅县,103.41943502426147,29.83003644862373,三宝新日电动车,四川省,,
宝兴路16,广元市,利州区,105.64143,32.374701,宝轮新日电动车,四川省,,
育才路与212国道交叉口南100米,广元市,利州区,105.927978,32.394685,大石新日电动车,四川省,,
元坝镇葭萌路543号,广元市,昭化区,105.963945,32.323256,元坝新日电动车,四川省,,
下西街道,广元市,利州区,105.79277023673059,32.42177468391206,河西新日电动车,四川省,,
嘉陵街道,广元市,利州区,105.82324951887132,32.44339894261998,北门新日电动车,四川省,,
红岩镇,广元市,昭化区,105.73851853609085,32.20802623542708,红岩新日电动车,四川省,,
东河镇,广元市,旺苍县,106.28990560770033,32.22891768047886,旺苍新日电动车,四川省,,
陵江镇,广元市,苍溪县,105.93480125069621,31.732433191143716,苍溪新日电动车,四川省,,
红星路110号,广元市,苍溪县,106.151709,31.880351,歧坪新日电动车,四川省,,
白龙镇,广元市,剑阁县,105.57207137346268,31.80695004051526,白龙新日电动车,四川省,,
三贤祠街道,资阳市,雁江区,104.6242618560791,30.111702791942413,姜安新日电动车,四川省,,
狮子山街道,资阳市,雁江区,104.62786942720413,30.150534848577912,西溪新日电动车,四川省,,
绥山镇,乐山市,峨眉山市,103.49270895123482,29.593898326264135,富顺县赵化镇,四川省,,
板桥镇,自贡市,富顺县,104.783675,29.127367,富顺县板桥镇,四川省,,
柏溪镇,宜宾市,叙州区,104.54723283648494,28.713256575852803,宜宾县,四川省,,
沙河镇,宜宾市,高县,104.74774807691576,28.550809897656965,沙河,四川省,,
沙河镇,宜宾市,高县,104.75109547376633,28.55515551508239,沙河,四川省,,
蕨溪镇,宜宾市,叙州区,104.26186457276346,28.922918982002255,蕨溪,四川省,,
庆符镇,宜宾市,高县,104.51601862907411,28.436126452589622,高县,四川省,,
嘉明镇,泸州市,泸县,105.40327727794647,29.243501973531647,泸县喻寺镇,四川省,,
福集镇,泸州市,泸县,105.3280855715275,29.19621099603873,泸县太和镇,四川省,,
福集镇,泸州市,泸县,105.4089233279228,29.1996961791668,泸县石马镇,四川省,,
方洞镇,泸州市,泸县,105.44930800795555,29.259609439746804,方洞镇,四川省,,
云锦镇,泸州市,泸县,105.64401626586915,29.08036820489986,云锦镇,四川省,,
