address,city,districd,lat,lon,name,province,street,town
江苏省扬州市广陵区湾头镇扬州正宇锅炉有限公司,扬州市,广陵区,119.495332,32.420718,湾头新日,江苏省,,
江苏省扬州市邗江区甘泉街道七泉路213号,扬州市,邗江区,119.343436,32.481984,甘泉新日,江苏省,,
江苏省扬州市广陵区泰安镇金桥东路24号,扬州市,广陵区,119.517409,32.458651,泰安新日,江苏省,,
江苏省扬州市邗江区方巷镇黄珏幼儿园,扬州市,邗江区,119.403046,32.548468,黄珏新日,江苏省,,
江苏省扬州市广陵区沙头镇中共扬州市广陵区沙头镇委员会,扬州市,广陵区,119.524069,32.305405,沙头新日,江苏省,,
江苏省扬州市广陵区李典镇扬州市华祥医疗器械厂,扬州市,广陵区,119.60815,32.280484,新坝新日,江苏省,,
江苏省扬州市邗江区城北乡上方寺路18号鸿福二村,扬州市,邗江区,119.444293,32.42306,竹西路,江苏省,,
江苏省扬州市江都区仙女镇同桥路,扬州市,江都区,119.639439,32.435391,新火新日,江苏省,,
江苏省扬州市广陵区东关街道扬州市第一中学,扬州市,广陵区,119.449591,32.396131,扬州文昌路店,江苏省,,
江苏省扬州市江都区仙女镇利民北路84号,扬州市,江都区,119.55754,32.433346,江都利民桥店,江苏省,,
江苏省扬州市江都区仙女镇长江东路265号,扬州市,江都区,119.598838,32.430891,江都三店,江苏省,,
江苏省扬州市江都区仙女镇长江东路265号,扬州市,江都区,119.598838,32.430891,江都服务中心,江苏省,,
江苏省扬州市广陵区东关街道扬州市第一中学,扬州市,广陵区,119.449591,32.396131,扬州服务中心,江苏省,,
江苏省扬州市江都区仙女镇东方红东路50号润园商业广场,扬州市,江都区,119.580688,32.431364,润园社区店,江苏省,,
仙女镇龙城路89号金业龙津大厦104室,扬州市,江都区,119.562627,32.420198,龙城路社区店,江苏省,,
爱园镇,宿迁市,泗阳县,118.72898653149606,33.94453814670382,爱园新日,江苏省,,
高渡镇,宿迁市,泗阳县,118.66878032684325,33.50075781903118,高渡新日专卖,江苏省,,
庄圩乡,宿迁市,泗阳县,118.85079771280287,33.923647430859646,庄圩新日专卖,江苏省,,
裴圩镇,宿迁市,泗阳县,118.75581800937653,33.48667369186316,黄圩新日专卖,江苏省,,
城厢街,宿迁市,泗阳县,118.649568,33.685871,城厢新日专卖,江苏省,,
江苏泗阳开发区,宿迁市,泗阳县,118.73568534851073,33.696070234805454,桂庄小区新日专卖,江苏省,,
张家圩镇,宿迁市,泗阳县,118.68460536003114,33.886227173606514,张家圩新日专卖,江苏省,,
李口镇,宿迁市,泗阳县,118.7255921959877,33.62049034667083,李口新日专卖,江苏省,,
里仁乡,宿迁市,泗阳县,118.79485487937927,33.91321851510713,泗阳里仁新日,江苏省,,
江苏省苏州市张家港市金港镇长江西路,无锡市,江阴市,120.376522,31.944969,金港新日电动车（黄）,江苏省,,
江苏省无锡市江阴市祝塘镇新庄路,无锡市,江阴市,120.411423,31.757891,祝塘新日电动车,江苏省,,
江苏省无锡市江阴市青阳镇旌阳北路64-3号,无锡市,江阴市,120.255494,31.766302,青阳新日电动车,江苏省,,
江苏省镇江市扬中市经济开发区扬中大道,镇江市,扬中市,119.849968,32.16722,兴隆镇新日专卖店,江苏省,,
江苏省泰州市泰兴市济川街道大庆中路25号,泰州市,泰兴市,120.015548,32.172361,泰兴市弘一百货商行,江苏省,,
310国道北100米,徐州市,邳州市,117.758469,34.469559,车夫山新日专卖,江苏省,,
江苏省淮安市金湖县黎城镇人民路75-24号,淮安市,金湖县,119.020632,33.015089,新日人民路店,江苏省,,
江苏省徐州市睢宁县睢城镇天虹大道睢宁县中医院,徐州市,睢宁县,117.961583,33.90134,睢宁县万达车行,江苏省,,
皂河镇,宿迁市,宿豫区,118.11405658721924,34.03537171172268,宿迁皂河新日,江苏省,,
双山南路附近,盐城市,射阳县,120.243312,33.762914,射阳新日店,江苏省,,
古城路北50米,徐州市,邳州市,117.965958,34.467869,邳城新日,江苏省,,
邳州市,徐州市,邳州市,118.044945,34.32589,炮车新日,江苏省,,
戴邢线与302县道交叉口南150米,徐州市,邳州市,117.831612,34.562691,大固新日,江苏省,,
江苏省淮安市清江浦区通甫路139号福星花园(新庄路),淮安市,清江浦区,119.06454,33.571125,福星花园,江苏省,,
江苏省淮安市淮阴区新渡乡新渡中心小学,淮安市,淮阴区,119.096945,33.643401,新渡新日,江苏省,,
250省道附近,徐州市,邳州市,118.034935,34.533764,铁富新日,江苏省,,
云坛东路北50米,徐州市,邳州市,117.897003,34.539936,岔河新日,江苏省,,
四户镇四户街13号,徐州市,邳州市,117.979942,34.622162,石羊新日,江苏省,,
邳州19路,徐州市,邳州市,117.830917,34.301548,古邳新日,江苏省,,
中扬镇,宿迁市,宿城区,118.50709944963454,33.695906213745765,中扬新日,江苏省,,
江苏省无锡市惠山区无锡惠山经济开发区无锡新天一教育时代广场6号楼,无锡市,惠山区,120.295089,31.678238,堰桥新日电动（范）,江苏省,,
江苏省苏州市张家港市杨舍镇澄鹿路48号,无锡市,江阴市,120.512578,31.847001,包基新日电动车,江苏省,,
江苏省苏州市张家港市张家港经济技术开发区金塘商务宾馆(金塘路)聚丰新村,苏州市,张家港市,120.55845,31.817708,塘市新日电动车,江苏省,,
青湖镇,连云港市,东海县,118.8325560092926,34.67207516314208,青湖新日,江苏省,,
石榴街道,连云港市,东海县,118.70219931006433,34.56136740419159,大兴新日,江苏省,,
石梁河镇,连云港市,东海县,118.74074935913086,34.74259329642042,南辰新日,江苏省,,
石榴街道,连云港市,东海县,118.77000957727431,34.56277995192799,石榴新日,江苏省,,
温泉镇,连云港市,东海县,118.68596389889719,34.60330951462681,温泉新日,江苏省,,
曲阳乡,连云港市,东海县,118.69559437036516,34.44418502913645,曲阳新日,江苏省,,
白塔埠镇,连云港市,东海县,118.97863849997522,34.62766940890922,前营新日,江苏省,,
山左口乡,连云港市,东海县,118.48505169153214,34.59438426306865,山左口新日,江苏省,,
李埝乡,连云港市,东海县,118.60632777214049,34.66992547976316,李埝新日,江苏省,,
江苏省泰州市靖江市城北园区唯高公寓,泰州市,靖江市,120.271244,32.031581,靖城新日电动车,江苏省,,
牛山街道,连云港市,东海县,118.77483889460565,34.525869132148806,温泉朱沟新日,江苏省,,
安峰镇,连云港市,东海县,118.78518819808963,34.339100834277374,安峰峰南新日,江苏省,,
白塔埠镇,连云港市,东海县,118.93975853919986,34.572404296459105,白塔新日,江苏省,,
黄川镇,连云港市,东海县,118.95831808447838,34.679330070521736,黄川宋吴新日专卖,江苏省,,
牛山街道,连云港市,东海县,118.75430524349214,34.52701932122204,牛山镇金牛公园店,江苏省,,
江苏省扬州市江都区仙女镇长江路285号鸿江花园,扬州市,江都区,119.578002,32.421306,江都城北店,江苏省,,
江苏省扬州市邗江区双桥街道翠岗中学,扬州市,邗江区,119.408715,32.402808,扬州翠岗店,江苏省,,
江苏省扬州市广陵区文峰街道江阳东路鸿锦花园,扬州市,广陵区,119.45285,32.379876,东花园店,江苏省,,
江苏省扬州市江都区仙女镇正谊小学,扬州市,江都区,119.612593,32.405093,正宜店,江苏省,,
石梁河镇,连云港市,东海县,118.86683061718944,34.75585716456208,石梁河新日,江苏省,,
石榴街道,连云港市,东海县,118.68270903825761,34.57582859372061,石榴镇姜庄燕伟车行,江苏省,,
黄河西路18号号附近,徐州市,铜山区,117.179382,34.185299,徐州铜山新日,江苏省,,
香港街30号华清池向南10米,徐州市,沛县,116.936981,34.732674,沛县新日旗舰店,江苏省,,
阜城镇,盐城市,阜宁县,119.76457804441453,33.77803484501209,阜宁社区1店,江苏省,,
阜城镇,盐城市,阜宁县,119.80839595198631,33.75614000388222,阜宁社区2店,江苏省,,
江苏省苏州市张家港市锦丰镇泓南新村张家港合兴初级中学,苏州市,张家港市,120.592621,31.925147,合兴新日电动车（黄）,江苏省,,
江苏省苏州市张家港市金港镇中圩新村中兴小学,苏州市,张家港市,120.427853,31.952802,金港新日电动车（张）,江苏省,,
江苏省苏州市常熟市虞山镇金虞花园,苏州市,常熟市,120.73138,31.6189,安定街新日电动车,江苏省,,
江苏省徐州市邳州市宿羊山镇宿羊山镇人民政府,徐州市,邳州市,117.763442,34.390576,宿羊山新日,江苏省,,
江苏省徐州市邳州市戴庄镇淮海路4号,徐州市,邳州市,117.864022,34.51014,戴庄新日,江苏省,,
江苏省徐州市邳州市碾庄镇邳州市岱山防保站,徐州市,邳州市,117.685242,34.325997,岱山新日,江苏省,,
江苏省徐州市邳州市议堂镇议堂镇人民政府,徐州市,邳州市,117.891508,34.261029,议堂新日,江苏省,,
江苏省苏州市常熟市虞山镇新加坡花园锦洪苑小区,苏州市,常熟市,120.761875,31.669888,长江路新日电动车,江苏省,,
江苏省苏州市吴中区郭巷街道姜庄路,苏州市,吴中区,120.664071,31.254002,郭巷新日电动车,江苏省,,
江苏省苏州市吴江区盛泽镇杨扇路,苏州市,吴江区,120.676644,30.890053,盛泽南环路分店,江苏省,,
江苏省徐州市沛县安国镇沛县安国镇卫生院,徐州市,沛县,116.839626,34.833591,安国新日,江苏省,,
江苏省徐州市睢宁县官山镇睢宁县黄圩中学,徐州市,睢宁县,117.875094,33.754838,黄圩新日,江苏省,,
弘文路与朝阳东路交叉口西南50米,盐城市,盐都区,119.98059,33.25171,盐城北蒋店,江苏省,,
人民中路41,盐城市,盐都区,119.85849,33.227578,盐城义丰店,江苏省,,
双拥北路218号,盐城市,射阳县,120.266005,33.784668,射阳黄海路店,江苏省,,
江苏省无锡市江阴市长泾镇嘉伦光彩大药房(江阴曼红店),无锡市,江阴市,120.456465,31.722615,河塘新日速修,江苏省,,
江苏省苏州市张家港市杨舍镇沙洲中路181号西门南村,苏州市,张家港市,120.538261,31.863578,沙洲路新日速修,江苏省,,
新袁镇,宿迁市,泗阳县,118.75831648707391,33.54898526764034,杨莹莹2新袁新日,江苏省,,
江苏省无锡市惠山区洛社镇雅西社区卫生服务站周强新村,无锡市,惠山区,120.214908,31.640561,洛社雅西路新日电动车,江苏省,,
桃林镇,连云港市,东海县,118.48315939307214,34.50999578499515,东海桃林新日专卖店,江苏省,,
江苏省无锡市锡山区锡北镇301县道,无锡市,锡山区,120.40612,31.651318,无锡八士新日速修,江苏省,,
江苏省无锡市惠山区无锡惠山经济开发区政和大道109号复地公园城邦,无锡市,惠山区,120.291201,31.679106,无锡前洲丛伟路新日速修,江苏省,,
江苏省无锡市惠山区前洲街道新洲家园,无锡市,惠山区,120.221547,31.699884,无锡前洲新洲花园新日速修,江苏省,,
江苏省无锡市锡山区鹅湖镇甘厚路,无锡市,锡山区,120.570548,31.546062,无锡甘露新日速修,江苏省,,
江苏省无锡市惠山区无锡惠山经济开发区政和大道109号复地公园城邦,无锡市,惠山区,120.291158,31.679067,无锡荡口新日速修,江苏省,,
江苏省无锡市惠山区前洲街道西塘村人民调解委员会,无锡市,惠山区,120.205649,31.683312,无锡前洲西塘菜场新日速修,江苏省,,
江苏省无锡市江阴市顾山镇顾山镇人民政府,无锡市,江阴市,120.555885,31.733797,江阴顾山新日速修,江苏省,,
江苏省苏州市张家港市塘桥镇蓝天纺织,苏州市,张家港市,120.627967,31.85206,张家港鹿苑新日速修,江苏省,,
江苏省无锡市江阴市临港街道西城路108号,无锡市,江阴市,120.194069,31.883501,江阴夏港新日速修,江苏省,,
江苏省无锡市锡山区羊尖镇洲翔饭店,无锡市,锡山区,120.55853,31.625254,无锡羊尖新日速修,江苏省,,
江苏省无锡市惠山区无锡惠山经济开发区堰玉东路,无锡市,惠山区,120.277901,31.689242,无锡堰桥堰玉东路新日速修,江苏省,,
江苏省无锡市惠山区无锡惠山经济开发区欣惠路148-150号天力百好锦园,无锡市,惠山区,120.297763,31.672675,无锡堰桥新惠路新日速修,江苏省,,
江苏省扬州市江都区真武镇江都区杨庄幼儿园,扬州市,江都区,119.57354,32.580505,杨庄新日电动车,江苏省,,
牛山街道,连云港市,东海县,118.75524267554283,34.52541391364211,东海金牛公园店,江苏省,,
合德镇,盐城市,射阳县,120.20821943879126,33.73819096000892,射阳凤凰村店,江苏省,,
江苏省苏州市张家港市金港镇嘉和宾馆(澄杨路),苏州市,张家港市,120.451675,31.925083,后塍澄杨路新日电动车,江苏省,,
江苏省泰州市靖江市季市镇229省道,泰州市,靖江市,120.308537,32.137209,季市三元桥新日电动车,江苏省,,
振兴街2号附近,淮安市,盱眙县,118.700787,32.766818,张洪新日,江苏省,,
天泉湖镇,淮安市,盱眙县,118.54653060436252,32.76527415001038,古城新日,江苏省,,
明祖陵镇,淮安市,盱眙县,118.4246389567852,33.07545270929198,项庄新日,江苏省,,
淮城镇康马路都市花园d区127号,淮安市,淮安区,119.1391,33.542385,康马路新日,江苏省,,
翔宇北道98号附近,淮安市,淮阴区,119.050026,33.630592,海通花园店,江苏省,,
刘老庄乡,淮安市,淮阴区,118.97276178002359,33.80727015114789,刘庄新日,江苏省,,
和畅路66号,淮安市,清江浦区,119.156804,33.580285,徐杨新日,江苏省,,
韩桥乡,淮安市,淮阴区,118.82917374372482,33.449790010834704,韩桥新日,江苏省,,
富城路西50米,淮安市,清江浦区,119.076716,33.540601,奥体新城店,江苏省,,
江苏省无锡市江阴市周庄镇长寿面馆(云顾路),无锡市,江阴市,120.384398,31.803618,长寿新日电动车,江苏省,,
江苏省扬州市江都区仙女镇新都南路489号,扬州市,江都区,119.593124,32.403722,商贸城新日店,江苏省,,
江苏省扬州市江都区仙女镇文昌东路,扬州市,江都区,119.614685,32.413014,余桥新日,江苏省,,
江苏省镇江市京口区大港街道丹徒区运政稽查大队高桥中队高桥客运公用站,镇江市,丹徒区,119.654019,32.231131,高桥新日,江苏省,,
江苏省扬州市宝应县柳堡镇锦云路23号,扬州市,宝应县,119.479839,33.13099,芦村新日,江苏省,,
江苏省扬州市宝应县安宜镇宝应县环境卫生管理处城南环卫所,扬州市,宝应县,119.318073,33.229611,城南工农路新日,江苏省,,
江苏省泰州市姜堰区大伦镇江海路,泰州市,姜堰区,120.24693,32.444612,姜堰大伦店,江苏省,,
江苏省南京市秦淮区五老村街道羊皮巷10号苏宁生活广场(新街口店),南京市,秦淮区,118.786449,32.036366,南京汇川新街口苏宁,江苏省,,
江苏省泰州市姜堰区张甸镇204县道,泰州市,姜堰区,120.098731,32.399993,姜堰梅垛,江苏省,,
江苏省南京市浦口区汤泉街道大吉温泉度假村,南京市,浦口区,118.491479,32.073615,南京浦口汤泉,江苏省,,
江苏省南京市秦淮区洪武路街道绣花巷8号4幢绣花巷10号小区,南京市,秦淮区,118.799005,32.030924,南京汇川龙蟠中路,江苏省,,
江苏省南京市浦口区盘城街道盘城街道办事处,南京市,浦口区,118.715852,32.209931,南京六合盘城路,江苏省,,
江苏省南京市六合区雄州街道仁和商城(泰山路),南京市,六合区,118.851119,32.339316,南京六合区雄州街道,江苏省,,
江苏省南京市六合区龙袍街道东沟镇人民政府,南京市,六合区,118.988569,32.270209,南京六合区东沟镇,江苏省,,
江苏省徐州市邳州市运河街道金陵人家,徐州市,邳州市,117.960607,34.323328,邳州镇北二路店,江苏省,,
江苏省徐州市邳州市运河街道向阳小学,徐州市,邳州市,117.970041,34.299203,邳州向阳路店,江苏省,,
江苏省徐州市邳州市运河街道奚仲路,徐州市,邳州市,117.959507,34.320068,邳州镇北一路店,江苏省,,
江苏省扬州市邗江区梅岭街道老虎山路阳光大厦,扬州市,邗江区,119.442169,32.412278,老虎山路,江苏省,,
江苏省泰州市兴化市沈沦镇华雕卫浴,泰州市,兴化市,119.974074,32.787628,沈伦新日,江苏省,,
江苏省泰州市兴化市临城镇垛陈线,泰州市,兴化市,119.938309,32.829816,刘陆新日,江苏省,,
江苏省扬州市邗江区城北乡三星花园8号楼三星花园,扬州市,邗江区,119.459979,32.430405,三星花园店,江苏省,,
江苏省南京市六合区大厂街道新华六村社区劳动和社会保障服务站新华六村小区,南京市,六合区,118.742669,32.222371,南京六合大厂车辆城,江苏省,,
江苏省南京市秦淮区红花街道夹岗门,南京市,雨花台区,118.813292,31.977446,南京夹岗门,江苏省,,
江苏省南京市六合区大厂街道南钢体育馆南钢大学,南京市,六合区,118.74664,32.199409,南钢店,江苏省,,
新街镇,泰州市,泰兴市,120.11636182665825,32.329738970428714,泰兴市北新电动车,江苏省,,
新街镇南新街,泰州市,泰兴市,120.123051,32.29204,泰兴市南新镇新日电动车,江苏省,,
宣堡镇,泰州市,泰兴市,119.99430790543558,32.295234015037266,泰兴市宣堡电动车,江苏省,,
张桥镇,泰州市,泰兴市,120.06905838847163,32.11079805808398,泰兴市张桥新日电动车,江苏省,,
经济技术开发区,镇江市,丹阳市,119.60554316639902,31.99740024474281,丹阳欧尚超市,江苏省,,
华阳镇,镇江市,句容市,119.17283445596696,31.945116003769325,句容新日1店,江苏省,,
华阳镇,镇江市,句容市,119.17283445596696,31.945116003769325,句容新日2店,江苏省,,
江苏省泰州市兴化市钓鱼镇中国邮政储蓄银行(海河营业所),泰州市,兴化市,119.90865,33.087823,北芙新日,江苏省,,
江苏省盐城市亭湖区文峰街道格林豪泰酒店(大庆路店),盐城市,盐都区,120.132924,33.369393,盐城新日大庆路旗舰店,江苏省,,
江苏省盐城市阜宁县阜城镇阜城大街298号富建新村,盐城市,阜宁县,119.787612,33.782612,阜宁新日旗舰店,江苏省,,
穿城镇,宿迁市,泗阳县,118.62583279609679,33.91306937825359,泗阳穿城新日店,江苏省,,
罗圩乡,宿迁市,宿城区,118.28787446022037,33.75702866048773,罗圩新日店,江苏省,,
虞山镇,苏州市,常熟市,120.80212354660037,31.63406581067859,汽配城新日专卖店,江苏省,,
通达北路与黄河西路交叉口北150米,常州市,新北区,119.818996,31.899501,罗溪镇通航广场新日,江苏省,,
花园路24号,常州市,钟楼区,119.92175,31.777531,怀德路中路,江苏省,,
湖塘镇,常州市,武进区,119.94333654642105,31.675366007250847,大学城新日电动车,江苏省,,
湖塘镇,常州市,武进区,119.9538427591324,31.688888635602538,永盛中路新日店,江苏省,,
建坂路附近,常州市,武进区,120.015239,31.658678,震坂路，新日店,江苏省,,
薛家镇薛冶路3号,常州市,新北区,119.916684,31.85968,薛家老街新日店,江苏省,,
新桥大街,常州市,新北区,119.973938,31.860673,新前新日店,江苏省,,
创新一路附近,常州市,新北区,119.987751,31.85584,龙虎塘新日店,江苏省,,
椿桂坊与红梅南路交叉口西南100米,常州市,天宁区,119.966758,31.772151,红梅南路新日店,江苏省,,
武宜北路189号附近,常州市,武进区,119.943871,31.749807,中凉亭新日店,江苏省,,
经济开发区,扬州市,高邮市,119.45853397250177,32.80273389114749,服装城新日,江苏省,,
城东镇迎宾路98号,南通市,海安市,120.50205,32.546059,海安火车站店,江苏省,,
G328(宁海线),南通市,海安市,120.329601,32.498211,海安曲塘店,江苏省,,
江苏省无锡市宜兴市屺亭街道宜兴市广汇实验小学,无锡市,宜兴市,119.815545,31.400376,宜兴广汇路新日电动车,江苏省,,
牛塘镇湖滨北路201号,常州市,武进区,119.899951,31.729538,牛塘人民路新日店,江苏省,,
包场路与145乡道交叉口东北150米,南通市,海安市,120.693463,32.561452,海安李堡店 ,江苏省,,
江苏省无锡市宜兴市新街街道新村路西花园一村,无锡市,宜兴市,119.79286,31.357935,宜兴龙池路新日电动车,江苏省,,
001县道与498乡道交叉口西北150米,南通市,海安市,120.261954,32.664433,海安白甸新日,江苏省,,
邓庄街31号,南通市,海安市,120.321687,32.58852,海安邓庄新日,江苏省,,
茶山街道,常州市,天宁区,119.95923534035686,31.75738333856585,清凉新村新日店,江苏省,,
江苏省无锡市锡山区锡北镇泾声路11号泾悦华庭,无锡市,锡山区,120.438728,31.661703,张泾新日电动车,江苏省,,
永兴街道外环西路汇达广场(越江新村北),南通市,港闸区,120.825821,32.027755,南通越江路店,江苏省,,
002县道与612乡道交叉口东50米,南通市,如皋市,120.393495,32.342665,如皋夏堡新日,江苏省,,
江苏省无锡市锡山区安镇街道太芙路,无锡市,锡山区,120.479772,31.602858,安镇新日电动车,江苏省,,
新昌路南150米,常州市,钟楼区,119.895097,31.816,新闸新日店,江苏省,,
如皋市经济开发区,南通市,如皋市,120.51199436187744,32.46174334829575,如皋戴庄新日,江苏省,,
江苏省无锡市锡山区无锡锡山开发区南方国际电动车城商住楼,无锡市,锡山区,120.495288,31.610808,南方市场新日电动车,江苏省,,
江苏省无锡市锡山区鹅湖镇甘露苑27号楼甘露苑,无锡市,锡山区,120.573902,31.537814,甘露新日电动车,江苏省,,
江苏省无锡市锡山区东亭街道学士路94号国欧商务酒店,无锡市,锡山区,120.367761,31.58249,东亭新日电动车,江苏省,,
长江镇,南通市,如皋市,120.60347512364389,32.11309604528622,如皋江防店,江苏省,,
340乡道北50米,南通市,海安市,120.395204,32.43642,海安孙庄新日,江苏省,,
墩头村17组,南通市,海安市,120.353279,32.646865,海安墩头新日,江苏省,,
龙潭路与353乡道交叉口东北50米,南通市,海安市,120.393766,32.663199,海安囚湖新日,江苏省,,
下合和镇,南通市,海安市,120.366388,32.383788,海安雅周新日,江苏省,,
人民中路29号,南通市,海安市,120.24342,32.610037,海安沙岗店,江苏省,,
336省道北50米,泰州市,靖江市,120.489783,32.104776,如皋桥头新日,江苏省,,
长江中路与飞龙西路向南100米,常州市,钟楼区,119.934533,31.809866,银河湾新日店,江苏省,,
天宁街道,常州市,天宁区,119.96876120567322,31.778118879317084,红梅路新日店,江苏省,,
横山桥镇,常州市,武进区,120.12995794415475,31.781509369664033,兰化路新日店,江苏省,,
江苏省无锡市江阴市周庄镇砂山大道,无锡市,江阴市,120.429056,31.87794,周庄新日电动车,江苏省,,
江苏省无锡市江阴市长泾镇花园路,无锡市,江阴市,120.489338,31.749569,长泾新日电动车,江苏省,,
江苏省无锡市江阴市澄江街道万达广场(江阴店),无锡市,江阴市,120.243568,31.898084,江阴万达新日电动车,江苏省,,
江苏省无锡市江阴市云亭街道江阴市云亭中心幼儿园(云台路),无锡市,江阴市,120.340865,31.858013,云亭新日电动车,江苏省,,
江苏省无锡市江阴市月城镇江阴市月城镇司法所,无锡市,江阴市,120.224205,31.803049,月城新日电动车,江苏省,,
江苏省苏州市张家港市凤凰镇张市路89-99号西张小学,苏州市,张家港市,120.623712,31.791273,西张新日电动车,江苏省,,
江苏省苏州市张家港市杨舍镇人民西路港新花苑,苏州市,张家港市,120.509841,31.890506,泗港新日电动车,江苏省,,
大东镇,淮安市,涟水县,119.42277744412422,33.830876464727595,涟水县沈庄新日电动车,江苏省,,
涟城镇,淮安市,涟水县,119.26816686987877,33.78846578711132,涟水县军民新日速修,江苏省,,
涟城镇,淮安市,涟水县,119.26430448889734,33.77525022183668,涟州花园新日电动车,江苏省,,
陈师镇,淮安市,涟水县,119.16295319795611,33.81996602571284,涟水县陈师新日电动车,江苏省,,
涟城镇,淮安市,涟水县,119.25997406244277,33.763905681396906,涟水县中山路新日速修,江苏省,,
涟城镇,淮安市,涟水县,119.27954211831091,33.77289804767374,涟水县渠北路新日速修,江苏省,,
涟城镇,淮安市,涟水县,119.26304385066032,33.78538947122842,涟水县阳光嘉园新日电动车,江苏省,,
棉花庄镇,淮安市,淮阴区,119.04234498739243,33.74183437559264,淮安大兴新日电动车,江苏省,,
清江浦区富准路2号,淮安市,清江浦区,119.14921,33.601124,淮安富士康新日,江苏省,,
朱桥镇,淮安市,淮安区,119.27031397819519,33.50881492695753,淮安朱桥镇新日电动车,江苏省,,
西宋集镇,淮安市,淮阴区,118.88007536530495,33.78604598414759,淮安西宋集新日电动车,江苏省,,
石湖镇,淮安市,涟水县,119.61763054132464,33.94351348066364,涟水县石湖新日电动车,江苏省,,
成集镇,淮安市,涟水县,119.08603683114053,33.84885286791857,涟水县成集新日电动车,江苏省,,
东五街文化中心南侧,淮安市,洪泽区,118.876724,33.286396,洪泽东风路新日电动车,江苏省,,
官湖镇,徐州市,邳州市,118.00351873040202,34.43028393127464,邳州官湖新日电动车,江苏省,,
土山镇,徐州市,邳州市,117.82445311546327,34.233052129615714,邳州李庄新日电动车,江苏省,,
欢口镇,徐州市,丰县,116.66845723986624,34.86872030974242,丰县欢口新日电动车,江苏省,,
铁富镇,徐州市,邳州市,118.03879380226135,34.53468573764001,邳州铁富新日电动车,江苏省,,
杨集镇,连云港市,灌云县,119.48165997862817,34.31694722461963,灌云杨集新日电动车,江苏省,,
下车镇,连云港市,灌云县,119.27178651094438,34.38833103491382,灌云仲集新日电动车,江苏省,,
