address,city,districd,lat,lon,name,province,street,town
珊瑚镇,泰州市,泰兴市,120.321494,32.170965,泰兴市珊瑚镇新日专卖店,江苏省,,
姚王镇,泰州市,泰兴市,120.07475674152377,32.21620389099788,泰兴市姚王镇新日专卖店,江苏省,,
姜八南路,泰州市,泰兴市,120.178355,32.324595,泰兴市元竹镇新日专卖店,江苏省,,
根思乡老叶双野村三组1号,泰州市,泰兴市,120.078618,32.26112,泰兴市老叶镇新日专卖,江苏省,,
河曲线与307县道交叉口西南50米,泰州市,泰兴市,120.179832,32.157788,泰兴市常周镇新日专卖,江苏省,,
江宁东山天印大道716号新日电动车,南京市,江宁区,118.858081,31.959378,天印大道店,江苏省,,
宿城街道,连云港市,连云区,119.43388849496843,34.71337155633661,连云港云台农场王,江苏省,,
金山镇金山后石堰村,连云港市,赣榆区,119.064661,35.021116,金山新日电动专卖,江苏省,,
宋庄镇日照路3号,连云港市,赣榆区,119.146725,34.7838,赣榆宋庄新日电动专卖,江苏省,,
板浦镇政府对面,连云港市,海州区,119.247126,34.485324,板浦新日电动专卖,江苏省,,
东方中路28号,连云港市,连云区,119.382757,34.544186,东辛农场新日电动专卖,江苏省,,
中华西路45号,连云港市,连云区,119.364898,34.740262,徐沟新日电动专卖,江苏省,,
板浦镇中正社区,连云港市,海州区,119.278929,34.50172,中正新日电动专卖,江苏省,,
浦溪花园,镇江市,句容市,119.209707,31.748165,镇江天王镇新日专卖店,江苏省,,
204国道东50米,连云港市,海州区,119.244784,34.525191,宁海新日电动专卖,江苏省,,
幸福路街道,连云港市,海州区,119.13922235369681,34.57635420699848,海州新日电动专卖,江苏省,,
南北大道与新扬菱路交叉口东北50米,扬州市,高邮市,119.255204,32.663573,送桥新日电动车,江苏省,,
临泽镇川青中街附近,扬州市,高邮市,119.655751,33.014861,川青新日电动车,江苏省,,
兴华南路与府南路交叉口西100米,扬州市,高邮市,119.252739,32.621769,天山新日电动车,江苏省,,
二沟乡,扬州市,高邮市,119.584951,32.807071,二沟新日电动车,江苏省,,
卸甲镇伯勤集镇希望路89号,扬州市,高邮市,119.59138,32.719296,伯勤新日电动车1,江苏省,,
陈渡路19号附近,常州市,钟楼区,119.91705,31.774886,临泽新日电动车1,江苏省,,
郭集路53,扬州市,高邮市,119.332869,32.697868,郭集新日电动车1,江苏省,,
清河经济开发区,淮安市,清江浦区,119.085043,33.591376,大湖城邦新日电动车,江苏省,,
盱城镇四季华庭,淮安市,盱眙县,118.523435,33.004561,武墩新日电动车,江苏省,,
5路;淮阴202路;淮阴203路;淮阴212路,淮安市,淮阴区,118.931511,33.538128,码头新日电动车,江苏省,,
解放西路33号,淮安市,清江浦区,119.0273,33.578529,城南大包车行,江苏省,,
渔沟镇,淮安市,淮阴区,118.8985,33.701546,渔沟新日电动车,江苏省,,
39路;淮阴208路,淮安市,淮阴区,118.980904,33.708981,丁集新日电动车,江苏省,,
淮阴区,淮安市,淮阴区,118.994994,33.626576,盐河镇新日电动车1,江苏省,,
黄码乡三乐村,淮安市,清江浦区,119.090444,33.502434,黄码新日车行,江苏省,,
淮海东路27号,淮安市,清江浦区,119.037572,33.597392,和平新日车行,江苏省,,
圣诞路16,扬州市,宝应县,119.43942,33.177672,小管庄新日车行,江苏省,,
文化路南50米,扬州市,宝应县,119.399507,33.090442,范水新日电动车车行,江苏省,,
安宜镇北田路名仕华庭西门(希尔顿旁),扬州市,宝应县,119.332681,33.241157,宝应北田雅苑电动车行,江苏省,,
牌楼路与175乡道交叉口东南150米,扬州市,宝应县,119.505106,33.255399,望直港新日电动车,江苏省,,
交通路与科普巷交叉口东北100米,扬州市,宝应县,119.515451,33.365585,宝应安丰新日电动车,江苏省,,
老沿广线与009乡道交叉口北50米,扬州市,宝应县,119.39991,33.163308,贾桥新日电动车,江苏省,,
南园中路1174号附近,扬州市,宝应县,119.339768,33.227492,小颖电动车,江苏省,,
203县道西50米,淮安市,盱眙县,118.629336,33.05669,三兵车行,江苏省,,
维西路51号,淮安市,盱眙县,118.625893,33.016154,维桥新日电动车,江苏省,,
盱眙3路,淮安市,盱眙县,118.547691,33.010345,十里营新日车行,江苏省,,
振兴路与202县道交叉口西150米,淮安市,金湖县,119.191173,33.037116,银集新日电动车,江苏省,,
盱城镇四季华庭,淮安市,盱眙县,118.523435,33.004561,塔集新日,江苏省,,
淮河镇大桥街道,淮安市,盱眙县,118.491833,33.041204,淮河新日电动车1,江苏省,,
204县道东100米,淮安市,盱眙县,118.57606,33.085834,官滩新日车行1,江苏省,,
明祖陵镇,淮安市,盱眙县,118.448936,33.111756,明祖陵新日车行,江苏省,,
铁佛街道,淮安市,盱眙县,118.299692,33.04493,铁佛新日车行1,江苏省,,
旧铺镇平原路1号,淮安市,盱眙县,118.682629,32.813076,旧铺新日车行1,江苏省,,
振兴路117号,淮安市,洪泽区,119.035506,33.266219,岔河镇新日车行1,江苏省,,
义兴镇人兴路1号,淮安市,涟水县,119.35824,34.000309,义兴新日车行,江苏省,,
15路专线,扬州市,邗江区,119.437035,32.476837,扬州槐泗镇新日专卖店,江苏省,,
12路;30路,扬州市,广陵区,119.458336,32.41946,扬州竹西路新日专卖店,江苏省,,
陆集镇府前路107号,宿迁市,宿豫区,118.388046,33.882267,陆集新日,江苏省,,
海通镇,盐城市,射阳县,120.34092441201211,33.80485087971981,射阳县海通分销,江苏省,,
千秋镇,盐城市,射阳县,120.2339029312134,33.87266594376652,射阳千秋分销,江苏省,,
四明镇,盐城市,射阳县,120.06412848830222,33.887732359487856,射阳四明分销,江苏省,,
江苏省连云港市海州区青年路,连云港市,海州区,119.181769,34.598427,连云港动伦商贸有限公司,江苏省,,
南京市江宁区秦淮路11号,南京市,江宁区,118.818731,31.952317,南京拓睿机电科技有限公司(直营),江苏省,,
陈集镇,扬州市,仪征市,119.19619783759116,32.478924401412726,陈集镇新日专卖店,江苏省,,
辛丰路附近,镇江市,丹徒区,119.570604,32.119008,镇江辛丰镇骏驰车业新日专卖店,江苏省,,
大巷公园西侧150米,扬州市,仪征市,119.25289,32.570371,大巷镇新日专卖店,江苏省,,
大仪镇,扬州市,仪征市,119.24203947186471,32.53750652261518,仪征大仪镇新日电动车,江苏省,,
东台镇,盐城市,东台市,120.33112227916719,32.85014702526274,东台专卖店,江苏省,,
谷阳大道199号,镇江市,丹徒区,119.421343,32.124128,丹徒区小马车行,江苏省,,
隆塔公路北150米,扬州市,仪征市,119.32411,32.299335,仪征市朴集镇新日电动车,江苏省,,
中兴路71号附近,扬州市,仪征市,119.139528,32.420479,仪征市月塘镇谢集新日电动车,江苏省,,
301县道附近,徐州市,新沂市,118.141034,34.410106,新沂合沟镇新日电动车,江苏省,,
新安镇黄墩村九组,徐州市,新沂市,118.355952,34.398361,新沂黄墩镇新日电动车,江苏省,,
双塘镇高塘镇,徐州市,新沂市,118.530311,34.36825,新沂双塘镇新日电动车,江苏省,,
大庙镇文化西路,徐州市,鼓楼区,117.364734,34.263932,徐州大庙新日电动车,江苏省,,
323省道快捷宾馆附近,徐州市,铜山区,117.556259,34.29552,徐州大许镇新日电动车,江苏省,,
206国道大吴镇,徐州市,贾汪区,117.396226,34.3384,徐州大吴镇新日电动车,江苏省,,
华润路,徐州市,铜山区,117.193164,34.338152,徐州新台子新日电动车,江苏省,,
何桥镇,徐州市,铜山区,116.909893,34.451636,徐州何桥新日电动车,江苏省,,
旭东路488号,南京市,六合区,118.759605,32.223939,南京振吉旭东路车辆城,江苏省,,
江苏省如皋市城南街道马塘村,南通市,如皋市,120.638653,32.296857,如皋市亚兵摩托车商行,江苏省,,
桂五镇新桂路58号,淮安市,盱眙县,118.51759,32.871309,桂五新日电动车专卖店,江苏省,,
仇集镇清平路27号,淮安市,盱眙县,118.323196,32.830457,仇集新日电动车专卖,江苏省,,
穆店乡街道,淮安市,盱眙县,118.605221,32.918347,穆店新日电动车,江苏省,,
王兴镇,淮安市,淮阴区,119.11102,33.698128,王兴镇新日电动车车行,江苏省,,
机场路附近,扬州市,宝应县,119.33518,33.155932,刘堡新日电动车专卖店,江苏省,,
山阳镇,扬州市,宝应县,119.21482,33.268791,山阳新日电动车专卖店,江苏省,,
西湖镇司徒庙路112号,扬州市,邗江区,119.40033,32.425698,扬州西湖新日专卖店,江苏省,,
富福路与车桥东街交叉口东100米,淮安市,淮安区,119.387722,33.457895,车桥新日电动车,江苏省,,
苏中中路368号,扬州市,宝应县,119.318671,33.239368,顺河新日电动车,江苏省,,
淮阴206路,淮安市,淮阴区,118.862671,33.641212,三树新日电动车,江苏省,,
古寨乡,淮安市,淮阴区,118.994881,33.877749,古寨新日电动车,江苏省,,
南洋镇,盐城市,亭湖区,120.2377586066723,33.43488732381598,盐城南洋分销,江苏省,,
亭湖新区,盐城市,亭湖区,120.18087968230249,33.40369609072549,新民商业街分销,江苏省,,
张甸镇,泰州市,姜堰区,120.09862437844276,32.403702951561904,姜堰梅垛,江苏省,,
江苏省盐城市阜宁县阜城大街新日电动车专卖店,盐城市,阜宁县,119.787651,33.782633,阜宁县阜城二桃电动车门市,江苏省,,
海河镇,盐城市,射阳县,120.03547444939612,33.71719620702022,射阳海河分销,江苏省,,
盐城市大庆西路156号新日电动车专卖店,盐城市,盐都区,120.132808,33.36927,盐城市城南新区猎鹰电动车经营部,江苏省,,
东环路218号,苏州市,姑苏区,120.648961,31.31841,大润发东环店,江苏省,,
江安镇,南通市,如皋市,120.4489986598492,32.132480666736505,如皋葛市店,江苏省,,
江苏省泰州市兴化市建设东路104号,泰州市,兴化市,119.834142,32.91874,兴化市松柏电动车行-康成大润发,江苏省,,
金港镇德积德申路284号,苏州市,张家港市,120.497604,31.991682,德积新日电动车,江苏省,,
江苏省苏州市张家港市金港镇文星南路,苏州市,张家港市,120.45689,31.912113,后塍新日电动车,江苏省,,
亭湖新区,盐城市,亭湖区,120.18099769949912,33.403786775897274,盐城市新民商业街加盟直营店,江苏省,,
新丰镇,盐城市,大丰区,120.41073292493822,33.3607902756347,大丰方强新日,江苏省,,
口岸第二中心小学,泰州市,高港区,119.91039,32.29848,泰州市田河镇,江苏省,,
城东街道孙金村9组369号,泰州市,海陵区,119.914198,32.536827,泰州朱庄新日电动车专卖店,江苏省,,
海门工业园区,南通市,海门市,121.19514495134355,31.959376330062646,海门瑞祥,江苏省,,
张甸镇葛庄村,泰州市,姜堰区,120.026655,32.451195,姜堰蔡官店,江苏省,,
姜官东路与629乡道交叉口东150米,泰州市,姜堰区,120.15186,32.543461,姜堰官庄店,江苏省,,
三条桥路3条桥路2102号附近,南通市,海门市,121.384187,31.931959,海门三条桥店,江苏省,,
悦来镇人民中路170号,南通市,海门市,121.43033,31.935913,海门悦来店,江苏省,,
青湖镇,连云港市,东海县,118.8357250392437,34.66965193985768,东海青湖(新开待装),江苏省,,
南洋镇,盐城市,亭湖区,120.23819848895074,33.43493320971252,南洋分销,江苏省,,
大港街道,镇江市,京口区,119.68212157487872,32.160295915014345,大港君豪菜场新日专卖,江苏省,,
盐龙街道,盐城市,盐都区,120.09139716625214,33.31861302448592,盐城高新区,江苏省,,
阜城镇,盐城市,阜宁县,119.78897675871852,33.76607191789618,阜宁城南开发区,江苏省,,
枫津南路,苏州市,吴中区,120.638463,31.234513,红庄新日电动车,江苏省,,
太仓109路;太仓202路;太仓208路;太仓309路,苏州市,太仓市,121.202881,31.527201,新塘新日电动车,江苏省,,
顺昌路与254省道交叉口东100米,徐州市,丰县,116.558554,34.840951,顺河镇新日电动车,江苏省,,
丰县,徐州市,丰县,116.673574,34.671101,史店新日电动车,江苏省,,
丰县,徐州市,丰县,116.517671,34.601792,刘王楼新日电动车,江苏省,,
宜城街道,镇江市,丹徒区,119.446689337492,32.12383095712393,丹徒新日电动车,江苏省,,
梁寨镇粱寨镇,徐州市,丰县,116.753547,34.501672,新日电动车,江苏省,,
宋楼镇254省道,徐州市,丰县,116.60609,34.565361,宋楼镇新日电动车,江苏省,,
司徒镇,镇江市,丹阳市,119.49295476078987,31.975517230564964,小施车业,江苏省,,
吕城镇吕蒙南路31号,镇江市,丹阳市,119.74046,31.894168,吕城镇华子车业,江苏省,,
天王镇,镇江市,句容市,119.20970678329466,31.748163390205317,天王镇新日电动车,江苏省,,
徐杨老街38号1-102,淮安市,清江浦区,119.154865,33.576028,徐扬新日电动车,江苏省,,
支十一路与水渡口大道交叉口东100米,淮安市,清江浦区,119.05949,33.600209,钵池新日电动车,江苏省,,
朱桥镇,淮安市,淮安区,119.266157,33.507103,朱桥新日电动车,江苏省,,
腾飞路65号,淮安市,涟水县,119.499763,33.833904,黄营新日电动车,江苏省,,
102县道与203县道交叉口东100米,淮安市,涟水县,119.176316,33.814142,陈师镇,江苏省,,
苏州市浒关木材市场内公交站旁（长旺路5号）,苏州市,虎丘区,120.513878,31.402265,苏州诚易禾贸易有限公司,江苏省,,
亭湖新区,盐城市,亭湖区,120.20372271537782,33.391907332171726,黄山路,江苏省,,
亭湖新区,盐城市,亭湖区,120.20231857895851,33.39042928591216,开发区社区分销商,江苏省,,
虹桥路,南通市,崇川区,120.870962,31.997303,南通城南,江苏省,,
唐闸镇街道,南通市,港闸区,120.81547558307648,32.06390672398063,南通唐闸,江苏省,,
小海街道,南通市,崇川区,120.9624566137791,31.96054259299557,南通小海,江苏省,,
城头镇,连云港市,赣榆区,119.0139873325825,34.86956315675683,城头新日,江苏省,,
青沙线北50米,连云港市,赣榆区,119.02017,34.786987,殷庄新日(新开待装修),江苏省,,
班庄镇,连云港市,赣榆区,118.85779023170473,34.84598879138854,赣榆班庄新日(新开待装),江苏省,,
丁伙镇锦西北路38号,扬州市,江都区,119.628602,32.486609,江都锦西新日专卖店,江苏省,,
丁伙镇人民中路99号,扬州市,江都区,119.61351,32.514595,江都丁伙新日专卖店,江苏省,,
建阳镇,盐城市,建湖县,119.74433809518814,33.4950754575401,建湖建阳分销,江苏省,,
九龙口镇,盐城市,建湖县,119.65400397777557,33.40408793955402,建湖蒋营分销,江苏省,,
新河镇新河街,徐州市,邳州市,117.988513,34.187048,邳州新河镇新日电动车,江苏省,,
占城街占城镇附近,徐州市,邳州市,117.767602,34.176281,邳州占城新日电动车,江苏省,,
梁寨镇粱寨镇,徐州市,丰县,116.753547,34.501672,丰县梁寨新日电动车,江苏省,,
203县道附近,徐州市,丰县,116.680136,34.611949,套楼镇新日电动车,江苏省,,
祝塘镇文林华昌路富阳新村25号,无锡市,江阴市,120.392152,31.724251,文林新日专卖店,江苏省,,
藕塘路111号,无锡市,惠山区,120.178397,31.600631,藕塘新日专卖店,江苏省,,
平桥镇兴平街,淮安市,淮安区,119.21568,33.380031,平桥新日,江苏省,,
515路,淮安市,清江浦区,119.028976,33.431824,朱桥新日电动车,江苏省,,
范集镇政府淮安市范集镇委,淮安市,淮安区,119.062055,33.370038,范集新日,江苏省,,
振兴路和新街的交叉口附近,淮安市,淮安区,119.416279,33.603263,复兴新日,江苏省,,
63路,淮安市,淮安区,119.14592,33.457874,三堡新日,江苏省,,
东麒路东150米,南京市,江宁区,118.877946,31.97696,南京江宁上坊街道店,江苏省,,
15路;23路;23路(晚班车);53路;103路区间车,扬州市,邗江区,119.44516,32.476341,扬州槐泗镇新日电动车,江苏省,,
110县道附近,镇江市,润州区,119.337272,32.118275,镇江石马镇新日二店,江苏省,,
姚桥镇,镇江市,京口区,119.77420851588249,32.15641641522391,镇江姚桥新日电动车,江苏省,,
亭湖新区,盐城市,亭湖区,120.22026926279068,33.3993117416144,盐城跃进路分销,江苏省,,
羊寨镇,盐城市,阜宁县,119.66162279248239,33.92029331207472,阜宁北沙分销,江苏省,,
兴港南路与利港路交叉口东50米,无锡市,锡山区,120.554245,31.697199,东港新日专卖店,江苏省,,
人民路226号-228号(靠近南环新村),苏州市,姑苏区,120.625864,31.284406,人民路新日电动车,江苏省,,
济川街道,泰州市,泰兴市,120.02483412623407,32.156097373797806,泰兴市鼓楼南路新日电动车,江苏省,,
西南路与227省道交叉口西南200米,苏州市,常熟市,120.718896,31.583711,莫城新日电动车,江苏省,,
南京市六合区大厂毕洼路166号（化工园）,南京市,六合区,118.759954,32.223323,南京扬之航电动车有限公司,江苏省,,
江苏省宿迁市沭阳县北京路工商银行南首,宿迁市,沭阳县,118.766824,34.127874,沭阳县沭城远豪电动车经营部-大润发,江苏省,,
江苏省泗阳淮海中路16号,宿迁市,泗阳县,118.690667,33.725417,泗阳县起行电动车经营部-大润发,江苏省,,
近湖镇,盐城市,建湖县,119.78239998221399,33.472601816844424,建湖市区新建路社区店,江苏省,,
江苏省常熟市黄山路199号国际汽配城D4幢15-17号,苏州市,常熟市,120.80216,31.635118,常熟市虞山镇中奇电动车商行,江苏省,,
盐城市射阳县振阳大街新日电动车专卖店,盐城市,射阳县,120.256783,33.770253,射阳经济开发区得威电动车配件门市,江苏省,,
泗洪县泗州中大街17号（乾达公司）,宿迁市,泗洪县,118.221616,33.458605,泗洪县智通电动车配件经营部,江苏省,,
江苏省苏州市张家港市张家港市现代农业示范园区红旗路常阴沙生态农业旅游区,苏州市,张家港市,120.765979,31.87329,红旗新日电动车,江苏省,,
江苏省苏州市吴江区松陵镇江陵西路1185号,苏州市,吴江区,120.649007,31.178479,苏州斑马快线电动车服务有限公司,江苏省,,
江苏省苏州市吴江区太湖新城镇体育路17号,苏州市,吴江区,120.65563,31.146083,大发市场新日电动车,江苏省,,
江苏省苏州市吴江区太湖新城镇渔湾大道106号横扇文体广场,苏州市,吴江区,120.537314,31.012654,横扇新日电动车,江苏省,,
江苏省苏州市吴江区桃源镇青云路1049号,苏州市,吴江区,120.494304,30.847847,桃园新日电动车,江苏省,,
江苏省苏州市吴江区平望镇梅堰国土资源所,苏州市,吴江区,120.589279,30.976515,梅堰新日电动车,江苏省,,
江苏省苏州市吴江区震泽镇镇南路1138号,苏州市,吴江区,120.509454,30.912324,震泽新日电动车,江苏省,,
江苏省扬州市高邮市高邮街道武安路172号,扬州市,高邮市,119.462007,32.767791,武安新日,江苏省,,
江苏省扬州市高邮市汤庄镇汤庄镇人民政府,扬州市,高邮市,119.745362,32.770894,汤庄新日,江苏省,,
盛泽镇斜桥街蚕花公寓商住楼7号,苏州市,吴江区,120.663696,30.905146,吴江区盛泽镇开心电动车店,江苏省,,
江苏省徐州市邳州市运河街道民主路,徐州市,邳州市,117.959338,34.313111,邳州新日旗舰店,江苏省,,
江苏省徐州市邳州市运河街道民主路,徐州市,邳州市,117.95936,34.312865,龙奔新日电动车,江苏省,,
江苏省扬州市高邮市高邮街道净土寺塔广场,扬州市,高邮市,119.447827,32.772758,诚信车行,江苏省,,
江苏省徐州市邳州市土山镇邳州市薛集农村信用合作社,徐州市,邳州市,117.808871,34.214949,薛集,江苏省,,
江苏省扬州市高邮市高邮街道华联药店(傅公桥路)月塘花苑,扬州市,高邮市,119.441535,32.791529,傅公桥新日,江苏省,,
江苏省扬州市宝应县鲁垛镇鲁垛镇,扬州市,宝应县,119.516296,33.197375,鲁垛镇,江苏省,,
江苏省淮安市清江浦区人民北路16号玫瑰苑(上海路),淮安市,清江浦区,119.021369,33.594397,淮安人民路店,江苏省,,
江苏省淮安市淮阴区王营镇淮阴师范学院王营校区,淮安市,淮阴区,119.007826,33.6416,淮安淮阴店,江苏省,,
江苏省淮安市清江浦区巨一首府,淮安市,清江浦区,119.010618,33.594553,淮安巨一首府店,江苏省,,
众兴镇,宿迁市,泗阳县,118.68786022067071,33.71287013457253,淮海东路店,江苏省,,
江苏省无锡市惠山区洛社镇广石路,无锡市,惠山区,120.227493,31.6494,石塘湾新日电动车,江苏省,,
江苏省无锡市惠山区无锡惠山经济开发区欣惠路148-150号赛维拉·融域,无锡市,惠山区,120.297786,31.672879,堰桥新日电动车,江苏省,,
江苏省扬州市宝应县望直港镇宝应县獐狮医院,扬州市,宝应县,119.50423,33.25587,獐狮新日,江苏省,,
江苏省扬州市宝应县曹甸镇宝应农商银行下舍支行,扬州市,宝应县,119.447218,33.311042,下舍新日电动车,江苏省,,
江苏省徐州市睢宁县睢城镇元府西路188号,徐州市,睢宁县,117.942377,33.899405,睢宁县睢城镇万达农资门市,江苏省,,
江苏省徐州市睢宁县睢城镇元府西路188号,徐州市,睢宁县,117.942377,33.899405,睢宁县万达车行,江苏省,,
250省道西50米,徐州市,邳州市,118.000107,34.416348,官湖专卖店,江苏省,,
541乡道东100米,徐州市,邳州市,117.685608,34.272369,八义集新日专卖店,江苏省,,
石桥村附近,徐州市,邳州市,117.72216,34.201736,石桥新日专卖店,江苏省,,
二环路与开发区连接线交叉口东北100米,徐州市,邳州市,118.00386,34.272385,张楼新日专卖店,江苏省,,
经济开发区,徐州市,邳州市,117.945129,34.407845,红旗新日专卖店,江苏省,,
土山街157号,徐州市,邳州市,117.845604,34.217522,土山新日专卖店,江苏省,,
邳州21路,徐州市,邳州市,118.007568,34.303585,河湾新日,江苏省,,
古城路北50米,徐州市,邳州市,117.962563,34.468449,伽口新日,江苏省,,
燕子埠镇新街道,徐州市,邳州市,117.708565,34.498116,燕子埠新日,江苏省,,
红卫村李庄一组李海波门面,徐州市,邳州市,118.044426,34.324898,李庄新日,江苏省,,
新安路76号,徐州市,新沂市,118.345238,34.375874,新安路新日,江苏省,,
新沂3路,徐州市,新沂市,118.230675,34.241753,棋盘新日,江苏省,,
港头镇,徐州市,新沂市,118.233818,34.288639,港头新日,江苏省,,
阿湖镇黑埠街15号,徐州市,新沂市,118.608665,34.373062,黑布新日,江苏省,,
新沂11路,徐州市,邳州市,118.074646,34.180344,窑湾新日,江苏省,,
新沂11路,徐州市,新沂市,118.20137,34.366337,双庙新日,江苏省,,
高流镇,徐州市,新沂市,118.522171,34.315048,高流新日,江苏省,,
江苏省常熟市黄山路199号国际汽配城D4幢15-17号,苏州市,常熟市,120.80216,31.635118,常熟市虞山镇中奇电动车商行-常熟大润发,江苏省,,
江苏省沛县东风中路南侧金贸广场13号楼7号房,徐州市,沛县,116.936211,34.732779,沛县鑫浩电动车经营部,江苏省,,
江苏省南通市海安县海安镇中坝北路5号107室,南通市,海安市,120.45703,32.545072,海安县小鸟电动车经营部,江苏省,,
江苏省扬州市江都区大桥镇江都农村商业银行(大桥支行)润德至尊城市花苑东区,扬州市,江都区,119.716231,32.366602,大桥新日电动车,江苏省,,
江苏省扬州市江都区邵伯镇237省道,扬州市,江都区,119.518234,32.526451,邵伯镇新日电动车,江苏省,,
江苏省扬州市江都区吴桥镇通扬桥,扬州市,江都区,119.752403,32.443249,吴桥新日电动车,江苏省,,
江苏省扬州市江都区丁沟镇鸿邦环保漆,扬州市,江都区,119.68171,32.560859,丁沟镇新日电动车,江苏省,,
江苏省扬州市江都区浦头镇浦头中心小学,扬州市,江都区,119.832638,32.373623,浦头新日电动车,江苏省,,
江苏省扬州市江都区樊川镇樊川镇人民政府,扬州市,江都区,119.692709,32.660838,樊川新日电动车,江苏省,,
江苏省扬州市江都区真武镇蔡真公路日泰世纪乐购购物广场,扬州市,江都区,119.579635,32.613898,真武新日电动车,江苏省,,
江苏省扬州市江都区浦头镇高引公路,扬州市,江都区,119.81523,32.413515,高汉新日,江苏省,,
江苏省扬州市江都区小纪镇303县道,扬州市,江都区,119.747384,32.673804,富民新日,江苏省,,
江苏省扬州市江都区樊川镇江都农村商业银行(三周支行),扬州市,江都区,119.661279,32.62185,三周新日,江苏省,,
江苏省扬州市江都区大桥镇章墅村,扬州市,江都区,119.68378,32.388292,花荡新日,江苏省,,
江苏省扬州市江都区仙女镇新都路,扬州市,江都区,119.595366,32.392998,张纲新日,江苏省,,
江苏省扬州市江都区仙女镇江都曹王医院,扬州市,江都区,119.658075,32.399541,曹王新日,江苏省,,
江苏省扬州市江都区仙女镇江都区仙女镇中心小学樊套校区,扬州市,江都区,119.566656,32.45636,双沟新日,江苏省,,
江苏省扬州市江都区仙女镇砖桥中学,扬州市,江都区,119.627479,32.448633,砖桥新日,江苏省,,
江苏省扬州市江都区大桥镇江都大桥嘶马中心幼儿园,扬州市,江都区,119.779722,32.342584,嘶马新日,江苏省,,
江苏省扬州市江都区仙女镇明珠山庄(龙川北路),扬州市,江都区,119.573065,32.44182,明珠山庄新日,江苏省,,
江苏省扬州市江都区仙女镇世纪花园世纪花园东区,扬州市,江都区,119.570688,32.441712,世纪花园新日,江苏省,,
江苏省扬州市邗江区公道镇扬州市邗江永恩制鞋厂公道中学南校区,扬州市,邗江区,119.354392,32.585686,公道新日,江苏省,,
江苏省扬州市邗江区槐泗镇弘扬东路,扬州市,邗江区,119.442207,32.476379,酒甸镇新日电动车,江苏省,,
